id,title,thumbnail,short_description,game_url,genre,platform,publisher,developer,release_date,freetogame_profile_url
94,Battlerite,https://www.freetogame.com/g/94/thumbnail.jpg,A free-to-play team arena brawler developed by Stunlock Studios. Players play as one of several available champions on teams in 2v2 or 3v3 matches.,https://www.freetogame.com/open/battlerite,MOBA,PC (Windows),Stunlock Studios,Stunlock Studios,2016-09-21,https://www.freetogame.com/battlerite
95,Paladins,https://www.freetogame.com/g/95/thumbnail.jpg,"A free-to-play team-based shooter developed and published by Hi-Rez Games, the creators of SMITE. ",https://www.freetogame.com/open/paladins,Shooter,PC (Windows),Hi-Rez Studios,Hi-Rez Studios,2016-09-16,https://www.freetogame.com/paladins
99,Star Crusade,https://www.freetogame.com/g/99/thumbnail.jpg,A free-to-play sci-fi themed collectable card game developed and published by ZiMAD inc.,https://www.freetogame.com/open/star-crusade,Card Game,PC (Windows),"ZiMAD, Inc.","ZiMAD, Inc.",2016-09-08,https://www.freetogame.com/star-crusade
344,Omega Zodiac,https://www.freetogame.com/g/344/thumbnail.jpg,A Greek and Norse mythology based free-to-play action MMO developed and published by Proficient City and Game Hollywood.,https://www.freetogame.com/open/omega-zodiac,MMORPG,Web Browser,Proficient City,Game Hollywood,2016-08-25,https://www.freetogame.com/omega-zodiac
102,The Elder Scrolls: Legends,https://www.freetogame.com/g/102/thumbnail.jpg,A free-to-play CCG based on The Elder Scrolls franchise.,https://www.freetogame.com/open/elder-scrolls-legends,Card Game,PC (Windows),Bethesda Softworks,Bethesda Softworks,2016-08-04,https://www.freetogame.com/elder-scrolls-legends
106,Riders of Icarus,https://www.freetogame.com/g/106/thumbnail.jpg,"A free-to-play action MMORPG featuring mounted, in-air combat. ",https://www.freetogame.com/open/riders-of-icarus,MMORPG,PC (Windows),VALOFE,WeMade,2016-07-06,https://www.freetogame.com/riders-of-icarus
365,Naruto Online,https://www.freetogame.com/g/365/thumbnail.jpg,"A free-to-play MMO based on the popular anime series and manga, developed 
by Bandai Namco Entertainment. ",https://www.freetogame.com/open/naruto-online,MMORPG,Web Browser,OAS Games,Bandai Namco,2016-07-20,https://www.freetogame.com/naruto-online
62,Kritika: REBOOT,https://www.freetogame.com/g/62/thumbnail.jpg,A free-to-play hack-and-slash MMORPG with both a single-player adventure combat from En Masse Entertainment and ALL-M Co.,https://www.freetogame.com/open/kritika,MMORPG,PC (Windows),ALLM Co.,ALLM Co.,2016-06-08,https://www.freetogame.com/kritika
108,Zula,https://www.freetogame.com/g/108/thumbnail.jpg,A free-to-play online FPS developed and published by IDC/Games.,https://www.freetogame.com/open/zula,Shooter,PC (Windows),IDC/Games,IDC/Games,2016-06-23,https://www.freetogame.com/zula
109,LuckCatchers,https://www.freetogame.com/g/109/thumbnail.jpg,A free-to-play sandbox sim based on the novels of fantasy and steam-punk author A. Pehov.,https://www.freetogame.com/open/luckcatchers,MMORPG,PC (Windows),DiP Online,DiP Online,2016-06-15,https://www.freetogame.com/luckcatchers
110,UFO Online: Invasion,https://www.freetogame.com/g/110/thumbnail.jpg,"A free-to-play post-apocalyptic, turn-based tactical combat 
MMO developed by Bad Pixel. ",https://www.freetogame.com/open/ufo-online-invasion,MMORPG,PC (Windows),Bad Pixel,Bad Pixel,2016-06-08,https://www.freetogame.com/ufo-online-invasion
367,SAO’s Legend,https://www.freetogame.com/g/367/thumbnail.jpg,A free-to-play browser-based MMO based on the popular anime Sword Art Online.,https://www.freetogame.com/open/saos-legend,MMORPG,Web Browser,GameSprite,Raycreator Inc.,2016-06-24,https://www.freetogame.com/saos-legend
112,Weapons Of Mythology,https://www.freetogame.com/g/112/thumbnail.jpg,A 3D free-to-play fantasy MMORPG published by IDC/Games.,https://www.freetogame.com/open/weapons-of-mythology,MMORPG,PC (Windows),IDC/Games,Gamemag,2016-06-07,https://www.freetogame.com/weapons-of-mythology
116,Tree of Savior,https://www.freetogame.com/g/116/thumbnail.jpg,"A fantasy 3D MMORPG with a massive freedom of choice, cute looking characters and a distinct art style. ",https://www.freetogame.com/open/tree-of-savior,MMORPG,PC (Windows),IMC Games,IMC Games,2016-05-10,https://www.freetogame.com/tree-of-savior
118,Starbreak,https://www.freetogame.com/g/118/thumbnail.jpg,"A Roguelike MMORPG with MetroidVania-style platformer 
gameplay! Castlevania and Metroid fans will 
love this game! ",https://www.freetogame.com/open/starbreak,MMORPG,"PC (Windows), Web Browser",Crunchy Games,Crunchy Games,2016-05-10,https://www.freetogame.com/starbreak
119,Fantasy Tales Online,https://www.freetogame.com/g/119/thumbnail.jpg,"A free-to-play, retro MMO featuring puzzles, a rich crafting system and Randomly generated dungeons! ",https://www.freetogame.com/open/fantasy-tales-online,MMORPG,PC (Windows),Cold Tea Studio,Cold Tea Studio,2016-05-06,https://www.freetogame.com/fantasy-tales-online
370,Dragon Blood,https://www.freetogame.com/g/370/thumbnail.jpg,"A free-to-play browser MMORPG from 101XP, you'll harness your unique power and the blood of dragons that flows through your veins! ",https://www.freetogame.com/open/dragon-blood,MMORPG,Web Browser,101XP,101XP,2016-04-16,https://www.freetogame.com/dragon-blood
371,League of Angels 2,https://www.freetogame.com/g/371/thumbnail.jpg,A free to play browser MMORPG that captures all the beauty and elegance of its predecessor.,https://www.freetogame.com/open/league-angels-2,MMORPG,Web Browser,GTArcade,GTArcade,2016-04-06,https://www.freetogame.com/league-angels-2
117,Astral Heroes,https://www.freetogame.com/g/117/thumbnail.jpg,A free-to-play collectable card game from the creators of Astral Masters.,https://www.freetogame.com/open/astral-heroes,Card Game,PC (Windows),Apus Software,Apus Software,2016-03-15,https://www.freetogame.com/astral-heroes
124,Holodrive,https://www.freetogame.com/g/124/thumbnail.jpg,"A free-to-play 2D multiplayer shooter developed by BitCake Studio and published by Versus Evil in which players play as customizable robots or ""Dummys"". ",https://www.freetogame.com/open/holodrive,Shooter,PC (Windows),Versus Evil,BitCake Studio,2016-03-24,https://www.freetogame.com/holodrive
304,Cabal Online,https://www.freetogame.com/g/304/thumbnail.jpg,A free to play fast-paced skill-based MMORPG in a stunning world!,https://www.freetogame.com/open/cabal-online,MMORPG,PC (Windows),ESTsoft,ESTsoft,2016-02-17,https://www.freetogame.com/cabal-online
125,Atom Universe,https://www.freetogame.com/g/125/thumbnail.jpg,A free-to-play multiplayer online social Virtual World set in a theme park.,https://www.freetogame.com/open/atom-universe,Social,PC (Windows),Atom Republic,Atom Republic,2016-02-27,https://www.freetogame.com/atom-universe
128,Spellweaver,https://www.freetogame.com/g/128/thumbnail.jpg,"A free-to-play multiplayer online collectible card 
game that requires deep strategic and 
thinking.",https://www.freetogame.com/open/spellweaver,Card Game,PC (Windows),Dream Reactor,Dream Reactor,2016-02-02,https://www.freetogame.com/spellweaver
374,Clash of Avatars,https://www.freetogame.com/g/374/thumbnail.jpg,"A free to play 3D browser MMORPG with powerful Avatars, 50 mounts, 
and several loyal pets.",https://www.freetogame.com/open/clash-of-avatars,MMORPG,Web Browser,AMZgame,AMZgame,2016-01-19,https://www.freetogame.com/clash-of-avatars
134,War Trigger 3,https://www.freetogame.com/g/134/thumbnail.jpg,"A MMO shooter with infantry, vehicle, and air combat across massive maps! ",https://www.freetogame.com/open/wt3,Shooter,PC (Windows),Rocketeer Games,Rocketeer Games,2015-12-23,https://www.freetogame.com/wt3
136,VEGA Conflict,https://www.freetogame.com/g/136/thumbnail.jpg,A Cross-Platform free to play 2D sci-fi strategy MMO.,https://www.freetogame.com/open/vega-conflict,Strategy,PC (Windows),KIXEYE,KIXEYE,2015-12-15,https://www.freetogame.com/vega-conflict
137,Metal War Online: Retribution,https://www.freetogame.com/g/137/thumbnail.jpg,A high-speed multiplayer online concept car shooter game with racing elements!,https://www.freetogame.com/open/metal-war-online,Shooter,PC (Windows),GDT Limited,GDT Limited,2015-12-11,https://www.freetogame.com/metal-war-online
139,Immortal Empire,https://www.freetogame.com/g/139/thumbnail.jpg,A free to play multiplayer strategy RPG developed by Tactic Studios.,https://www.freetogame.com/open/immortal-empire,MMORPG,PC (Windows),Tactic Studios Inc.,Tactic Studios Inc.,2015-12-03,https://www.freetogame.com/immortal-empire
222,MechWarrior Online,https://www.freetogame.com/g/222/thumbnail.jpg,A free-to-play PvP game that's a faithful adaptation of the popular MechWarrior strategy board games.,https://www.freetogame.com/open/mechwarrior-online,Shooter,PC (Windows),Piranha Games Inc.,Piranha Games Inc.,2015-12-10,https://www.freetogame.com/mechwarrior-online
7,Armored Warfare,https://www.freetogame.com/g/7/thumbnail.jpg,A modern team-based MMO tank game from Obsidian Entertainment.,https://www.freetogame.com/open/armored-warfare,Shooter,PC (Windows),My.com (Mail.ru Group),Obsidian Entertainment,2015-10-08,https://www.freetogame.com/armored-warfare
149,America’s Army: Proving Grounds,https://www.freetogame.com/g/149/thumbnail.jpg,"Take a first person shooter, have the game developed by the U.S. Army and you’ve got America’s Army.",https://www.freetogame.com/open/americas-army,Shooter,PC (Windows),U.S. Army,U.S. Army,2015-10-01,https://www.freetogame.com/americas-army
346,One Piece Online 2,https://www.freetogame.com/g/346/thumbnail.jpg,"A free-to-play, browser-based 2D MMORPG based on the immensely popular One Piece franchise.",https://www.freetogame.com/open/one-piece-online-2,MMORPG,Web Browser,JoyGames,JoyGames,2015-09-25,https://www.freetogame.com/one-piece-online-2
97,Otherland,https://www.freetogame.com/g/97/thumbnail.jpg,A free-to-play MMO based on the popular novels by Tad Williams.,https://www.freetogame.com/open/otherland,MMORPG,PC (Windows),GmbH,Drago Entertainment,2015-09-10,https://www.freetogame.com/otherland
121,Forza Motorsport 6: Apex,https://www.freetogame.com/g/121/thumbnail.jpg,A free-to-play MMO racing game that comes from makers of one of the most popular video game racing series ever.,https://www.freetogame.com/open/forza-motorsport-6-apex,Racing,PC (Windows),Microsoft,Turn 10,2015-09-15,https://www.freetogame.com/forza-motorsport-6-apex
383,Legends of Honor,https://www.freetogame.com/g/383/thumbnail.jpg,A free to play browser based medieval fantasy 2D MMORTS.,https://www.freetogame.com/open/legends-of-honor,Strategy,Web Browser,Goodgame Empire,Goodgame Studios,2015-08-20,https://www.freetogame.com/legends-of-honor
384,Felspire,https://www.freetogame.com/g/384/thumbnail.jpg,A free-to-play 2D browser-based fantasy MMORPG with plenty of dungeons and world bosses to slay.,https://www.freetogame.com/open/felspire,MMORPG,Web Browser,37Games,37Games Entertainment,2015-08-07,https://www.freetogame.com/felspire
152,WARMODE,https://www.freetogame.com/g/152/thumbnail.jpg,"A Free to play multiplayer online shooter. Sight in enemies to master Headshots, Double Kills and Triple Kills! ",https://www.freetogame.com/open/warmode,Shooter,PC (Windows),WARTEAM,WARTEAM,2015-08-26,https://www.freetogame.com/warmode
154,Sphere 3: Enchanted World,https://www.freetogame.com/g/154/thumbnail.jpg,A fantasy action MMORPG with a non-target combat system.,https://www.freetogame.com/open/sphere-3,MMORPG,PC (Windows),NIKITA ONLINE,NIKITA ONLINE,2015-08-18,https://www.freetogame.com/sphere-3
157,Fishing Planet,https://www.freetogame.com/g/157/thumbnail.jpg,A Free to play realistic online first-person multiplayer fishing simulator!,https://www.freetogame.com/open/fishing-planet,Sports,PC (Windows),Fishing Planet LLC,Fishing Planet LLC,2015-08-11,https://www.freetogame.com/fishing-planet
386,Aberoth,https://www.freetogame.com/g/386/thumbnail.jpg,A free to play 8-bit MMORPG with retro graphics and MUD-like interface.,https://www.freetogame.com/open/aberoth,MMORPG,Web Browser,Jarbit,Jarbit,2015-07-17,https://www.freetogame.com/aberoth
159,Codename CURE,https://www.freetogame.com/g/159/thumbnail.jpg,"A free to play 3D MMOFPS featuring cooperative play, and objective-based missions.",https://www.freetogame.com/open/codename-cure,Shooter,PC (Windows),Hoobalugalar_X,Hoobalugalar_X,2015-07-18,https://www.freetogame.com/codename-cure
161,Skyforge,https://www.freetogame.com/g/161/thumbnail.jpg,A impressive Free to play MMORPG where you can become a god!,https://www.freetogame.com/open/skyforge,MMORPG,PC (Windows),My.com,Allods Team & Obsidian Entertainment Collaboration,2015-07-16,https://www.freetogame.com/skyforge
163,Card Hunter,https://www.freetogame.com/g/163/thumbnail.jpg,"A free online collectible card game which blends together role-playing, card play and tactical combat. ",https://www.freetogame.com/open/card-hunter,Card Game,"PC (Windows), Web Browser",Blue Manchu,Blue Manchu,2015-07-14,https://www.freetogame.com/card-hunter
104,Fallout Shelter,https://www.freetogame.com/g/104/thumbnail.jpg,A free-to-play simulation game based on Bethesda Game Studios' popular Fallout franchise.,https://www.freetogame.com/open/fallout-shelter,Strategy,PC (Windows),Bethesda Game Studios,Bethesda Game Studios,2015-06-14,https://www.freetogame.com/fallout-shelter
388,Lord’s Road,https://www.freetogame.com/g/388/thumbnail.jpg,A free-to-play 2D browser-based fantasy MMORPG that features two playable classes.,https://www.freetogame.com/open/lords-road,MMORPG,Web Browser,AMZGame,AMZGame,2015-06-03,https://www.freetogame.com/lords-road
167,Salem,https://www.freetogame.com/g/167/thumbnail.jpg,"A free-to-play, sandbox type MMO based on the times and trials of living.",https://www.freetogame.com/open/salem,MMORPG,PC (Windows),Mortal Moments,John Carver,2015-06-19,https://www.freetogame.com/salem
168,Heroes of the Storm,https://www.freetogame.com/g/168/thumbnail.jpg,A free to play MOBA developed by Blizzard Entertainment.,https://www.freetogame.com/open/heroes-of-the-storm,MOBA,PC (Windows),Blizzard Entertainment,Blizzard Entertainment,2015-06-02,https://www.freetogame.com/heroes-of-the-storm
169,Dirty Bomb,https://www.freetogame.com/g/169/thumbnail.jpg,A free-to-play first person shooter multiplayer game set in a post-apocalyptic London.,https://www.freetogame.com/open/dirty-bomb,Shooter,PC (Windows),"
Warchest Ltd.",Splash Damage,2015-06-01,https://www.freetogame.com/dirty-bomb
357,Vikings: War Of Clans,https://www.freetogame.com/g/357/thumbnail.jpg,A free-to-play MMO strategy game developed and published by Plarium.,https://www.freetogame.com/open/vikings-war-of-clans,Strategy,Web Browser,Plarium,Plarium,2015-04-15,https://www.freetogame.com/vikings-war-of-clans
391,Star Trek: Alien Domain,https://www.freetogame.com/g/391/thumbnail.jpg,A free to play browser based 2D strategy MMO set in the Stark Trek universe.,https://www.freetogame.com/open/star-trek-alien-domain,Strategy,Web Browser,GameSamba,GameSamba,2015-04-07,https://www.freetogame.com/star-trek-alien-domain
173,Block N Load,https://www.freetogame.com/g/173/thumbnail.jpg,A free-to-play multiplayer online shooter game that looks like a mix of Minecraft and Team Fortress 2.,https://www.freetogame.com/open/block-n-load,Shooter,PC (Windows),Jagex,"Jagex, Artplant",2015-04-30,https://www.freetogame.com/block-n-load
175,Survarium,https://www.freetogame.com/g/175/thumbnail.jpg,A free to play post-apocalyptic online FPS game.,https://www.freetogame.com/open/survarium,Shooter,PC (Windows),Vostok Games,Vostok Games,2015-04-02,https://www.freetogame.com/survarium
177,Dungeon Fighter Online,https://www.freetogame.com/g/177/thumbnail.jpg,A free to play arcade-style side-scrolling action game mixed with RPG elements.,https://www.freetogame.com/open/dungeon-fighter-online,Fighting,PC (Windows),Neople,Neople (Subsidiary of Nexon),2015-03-24,https://www.freetogame.com/dungeon-fighter-online
56,Grimoire: Manastorm,https://www.freetogame.com/g/56/thumbnail.jpg,A free-to-play multiplayer FPS... with wizards.,https://www.freetogame.com/open/grimoire-manastorm,Shooter,PC (Windows),Omniconnection,Omniconnection,2015-02-04,https://www.freetogame.com/grimoire-manastorm
373,StarColony,https://www.freetogame.com/g/373/thumbnail.jpg,A free-to-play browser MMO strategy game that puts you in command of a rapidly growing city on a dangerous alien world.,https://www.freetogame.com/open/starcolony,Strategy,Web Browser,Eiyland LLC,Eiyland LLC,2015-01-01,https://www.freetogame.com/starcolony
394,One Piece Online,https://www.freetogame.com/g/394/thumbnail.jpg,One Piece Online is a 2D Tower Defense Action MMO!,https://www.freetogame.com/open/one-piece-online,MMORPG,Web Browser,JoyGames,JoyGames,2015-01-22,https://www.freetogame.com/one-piece-online
179,Transformice,https://www.freetogame.com/g/179/thumbnail.jpg,A cute little free-to-play MMO platformer.,https://www.freetogame.com/open/transformice,Fantasy,"PC (Windows), Web Browser",Atelier 801,Atelier 801,2015-01-30,https://www.freetogame.com/transformice
180,Gear Up,https://www.freetogame.com/g/180/thumbnail.jpg,Control your unique tank or robot in multiplayer arcade action!,https://www.freetogame.com/open/gear-up,Shooter,PC (Windows),Doctor Entertainment,Doctor Entertainment,2015-01-29,https://www.freetogame.com/gear-up
181,8BitMMO,https://www.freetogame.com/g/181/thumbnail.jpg,A free to play retro­-style 2D MMO and a giant construction sandbox!,https://www.freetogame.com/open/8bitmmo,MMORPG,"PC (Windows), Web Browser",Archive Entertainment,Archive Entertainment,2015-01-26,https://www.freetogame.com/8bitmmo
399,Siegelord,https://www.freetogame.com/g/399/thumbnail.jpg,A free to play 2D medieval fantasy browser-based MMORTS.,https://www.freetogame.com/open/siegelord,Strategy,Web Browser,37Games Entertainment,37Games Entertainment,2014-12-19,https://www.freetogame.com/siegelord
182,Dungeon Defenders 2,https://www.freetogame.com/g/182/thumbnail.jpg,A free-to-play cooperative 3D tower-defense game by Trendy Entertainment.,https://www.freetogame.com/open/dungeon-defenders-2,Shooter,PC (Windows),Trendy Entertainment,Trendy Entertainment,2014-12-05,https://www.freetogame.com/dungeon-defenders-2
184,Blockade 3D,https://www.freetogame.com/g/184/thumbnail.jpg,A free to play FPS in an editable procedural world.,https://www.freetogame.com/open/blockade-3d,Shooter,PC (Windows),Shumkov Dmitriy,Shumkov Dmitriy,2014-11-05,https://www.freetogame.com/blockade-3d
185,Eldevin,https://www.freetogame.com/g/185/thumbnail.jpg,A indie story-driven Free to Play MMORPG.,https://www.freetogame.com/open/eldevin,MMORPG,"PC (Windows), Web Browser",Hunted Cow Studios,Hunted Cow Studios,2014-11-05,https://www.freetogame.com/eldevin
186,Double Action,https://www.freetogame.com/g/186/thumbnail.jpg,A free to play FPS with bullet time and stylish kills!,https://www.freetogame.com/open/double-action,Shooter,PC (Windows),Double Action Factory,Double Action Factory,2014-10-23,https://www.freetogame.com/double-action
187,Pox Nora,https://www.freetogame.com/g/187/thumbnail.jpg,A multiplayer online game that combines a collectible card game with a turn-based strategy game.,https://www.freetogame.com/open/pox-nora,Card Game,PC (Windows),Desert Owl Games LLC,Desert Owl Games LLC,2014-10-15,https://www.freetogame.com/pox-nora
188,Counter-Strike Nexon: Studio,https://www.freetogame.com/g/188/thumbnail.jpg,What's better than Counter-Strike? Counter-Strike with more modes and Zombies!,https://www.freetogame.com/open/counter-strike-nexon,Shooter,PC (Windows),Nexon Europe GmbH,Nexon,2014-10-07,https://www.freetogame.com/counter-strike-nexon
189,Uncharted Waters Online,https://www.freetogame.com/g/189/thumbnail.jpg,A free to play adventure MMORPG set on the high seas!,https://www.freetogame.com/open/uncharted-waters-online,MMORPG,PC (Windows),Papaya Play,"KOEI TECMO GAMES CO., LTD. ",2014-10-03,https://www.freetogame.com/uncharted-waters-online
10,ArcheAge,https://www.freetogame.com/g/10/thumbnail.jpg,"A free-to-play, hybrid fantasy/sandbox MMORPG brought to you by Trion Worlds.",https://www.freetogame.com/open/archeage,MMORPG,PC (Windows),Kakao Games,XL Games,2014-09-04,https://www.freetogame.com/archeage
404,Tribal Wars 2,https://www.freetogame.com/g/404/thumbnail.jpg,The sequel to the classic city-building strategy game Tribal Wars!,https://www.freetogame.com/open/tribal-wars-2,Strategy,Web Browser,InnoGames,InnoGames,2014-09-02,https://www.freetogame.com/tribal-wars-2
192,WAKFU,https://www.freetogame.com/g/192/thumbnail.jpg,"A 2D tactical turn-based fantasy MMORPG developed by Ankama Games, in conjunction with Square Enix.",https://www.freetogame.com/open/wakfu,MMORPG,PC (Windows),Ankama Games,Ankama Studio,2014-09-19,https://www.freetogame.com/wakfu
193,Infinity Wars,https://www.freetogame.com/g/193/thumbnail.jpg,"A MMO trading card game, Build up your decks and customize them with tons of factional cards! ",https://www.freetogame.com/open/infinity-wars,Card Game,PC (Windows),Lightmare Studios,Lightmare Studios,2014-09-05,https://www.freetogame.com/infinity-wars
195,Divine Souls,https://www.freetogame.com/g/195/thumbnail.jpg,A action-based MMORPG in a fantasy world with magic and technology.,https://www.freetogame.com/open/divine-souls,MMORPG,PC (Windows),Suba Games,GamePrix,2014-08-15,https://www.freetogame.com/divine-souls
196,Cubic Castles,https://www.freetogame.com/g/196/thumbnail.jpg,A free to play 3D Platforming and a open world building game.,https://www.freetogame.com/open/cubic-castles,MMO,PC (Windows),Cosmic Cow LLC,Cosmic Cow LLC,2014-08-13,https://www.freetogame.com/cubic-castles
198,Creativerse,https://www.freetogame.com/g/198/thumbnail.jpg,"Playful Corporation enters the sandbox, voxel world with their free-to-play title Creativers.",https://www.freetogame.com/open/creativerse,MMO,PC (Windows),Playful Corporation,Playful Corporation,2014-08-12,https://www.freetogame.com/creativerse
199,Royal Quest,https://www.freetogame.com/g/199/thumbnail.jpg,"A free to play fantasy MMORPG game with unique PvPvE locations, PvP Arenas, Battlegrounds and Castle Sieges. ",https://www.freetogame.com/open/royal-quest,MMORPG,PC (Windows),1C Online Games,Katauri,2014-08-06,https://www.freetogame.com/royal-quest
200,Guns and Robots,https://www.freetogame.com/g/200/thumbnail.jpg,A free to play online third person shooter with massive customization!,https://www.freetogame.com/open/guns-and-robots,Shooter,PC (Windows),"Masthead Studios Ltd, Thegamewallstudios, Gamigo AG",Masthead Studios Ltd,2014-08-05,https://www.freetogame.com/guns-and-robots
348,Bleach Online,https://www.freetogame.com/g/348/thumbnail.jpg,"A free to play 2D browser based MMORPG based on Bleach, the popular manga and anime series.",https://www.freetogame.com/open/bleach-online,MMORPG,Web Browser,GoGames,GoGames,2014-07-14,https://www.freetogame.com/bleach-online
203,Robocraft,https://www.freetogame.com/g/203/thumbnail.jpg,A free-to-play MMO sandbox building game!,https://www.freetogame.com/open/robocraft,MMO,PC (Windows),Freejam,Freejam,2014-07-08,https://www.freetogame.com/robocraft
204,Unturned,https://www.freetogame.com/g/204/thumbnail.jpg,"A independently developed free-to-play MMO survival 
game! ",https://www.freetogame.com/open/unturned,Shooter,PC (Windows),Smartly Dressed Games,Smartly Dressed Games,2014-07-08,https://www.freetogame.com/unturned
209,Freestyle2: Street Basketball,https://www.freetogame.com/g/209/thumbnail.jpg,A free to play MMO street basketball game. Team up with the best street ballers!,https://www.freetogame.com/open/freestyle2-street-basketball,Sports,PC (Windows),Joycity,Joycity,2014-06-20,https://www.freetogame.com/freestyle2-street-basketball
210,Fistful of Frags,https://www.freetogame.com/g/210/thumbnail.jpg,A first person shooter game set in the Wild West!,https://www.freetogame.com/open/fistful-of-frags,Shooter,PC (Windows),Fistful of Frags Team,Fistful of Frags Team,2014-05-10,https://www.freetogame.com/fistful-of-frags
211,GunZ 2: The Second Duel,https://www.freetogame.com/g/211/thumbnail.jpg,A free-to-play multiplayer Third Person Shooter and follow up to the successful GunZ: The Duel.,https://www.freetogame.com/open/gunz-2,Shooter,PC (Windows),MAIET Entertainme,MAIET Entertainme,2014-05-01,https://www.freetogame.com/gunz-2
213,Archeblade,https://www.freetogame.com/g/213/thumbnail.jpg,A free-to-play PvP-based multiplayer action game based on a Korean Fantasy Novel.,https://www.freetogame.com/open/archeblade,Fighting,PC (Windows),CodeBrush Games,CodeBrush Games,2014-04-25,https://www.freetogame.com/archeblade
214,Villagers and Heroes,https://www.freetogame.com/g/214/thumbnail.jpg,A free-to-play fantasy sandbox 3D MMORPG that has plenty to offer gamers.,https://www.freetogame.com/open/villagers-and-heroes,MMORPG,PC (Windows),Mad Otter Games,Mad Otter Games,2014-04-17,https://www.freetogame.com/villagers-and-heroes
215,Hex,https://www.freetogame.com/g/215/thumbnail.jpg,HEX combines roleplaying aspects of a MMO with the collectible and strategic gameplay of a Trading Card Game.,https://www.freetogame.com/open/hex,Card Game,PC (Windows),"Hex Entertainment, Gameforge",Cryptozoic Entertainment,2014-04-11,https://www.freetogame.com/hex
405,Pocket Starships,https://www.freetogame.com/g/405/thumbnail.jpg,A free-to-play cross-platform space combat MMO from SPYR games.,https://www.freetogame.com/open/pocket-starships,Strategy,Web Browser,Spyr,Spyr,2014-03-00,https://www.freetogame.com/pocket-starships
