id,title,thumbnail,short_description,game_url,genre,platform,publisher,developer,release_date,freetogame_profile_url
409,Sparta: War of Empires,https://www.freetogame.com/g/409/thumbnail.jpg,A 2D browser-based MMORTS in which players must exercise their city-management skills to construct and upgrade different structures and troops.,https://www.freetogame.com/open/sparta-war-empires,Strategy,Web Browser,Plarium,Plarium,2014-03-13,https://www.freetogame.com/sparta-war-empires
239,Dogs of War Online,https://www.freetogame.com/g/239/thumbnail.jpg,Based on the famous miniature board game Confrontation!,https://www.freetogame.com/open/dogs-war-online,Strategy,PC (Windows),Cyanide,Cyanide,2014-02-04,https://www.freetogame.com/dogs-war-online
220,Hearthstone: Heroes of Warcraft,https://www.freetogame.com/g/220/thumbnail.jpg,"Blizzard's free-to-play collectible card game that 
draws its inspiration from World of Warcraft. ",https://www.freetogame.com/open/hearthstone-heroes-warcraft,Card Game,PC (Windows),Blizzard Entertainment,Blizzard Entertainment,2014-01-21,https://www.freetogame.com/hearthstone-heroes-warcraft
221,Lucent Heart,https://www.freetogame.com/g/221/thumbnail.jpg,A free to play MMORPG with a match making system that helps players find their soulmates.,https://www.freetogame.com/open/lucent-heart,MMORPG,PC (Windows),Suba Games,Playcoco (Subsidiary of Gamania),2014-01-10,https://www.freetogame.com/lucent-heart
376,League of Angels,https://www.freetogame.com/g/376/thumbnail.jpg,A free to play 2D browser-based fantasy MMORPG with turn-based combat.,https://www.freetogame.com/open/league-of-angels,MMORPG,Web Browser,GTArcade,Youzu Interactive,2013-12-10,https://www.freetogame.com/league-of-angels
206,Aura Kingdom,https://www.freetogame.com/g/206/thumbnail.jpg,Aura Kingdom is a 3D free-to-play Anime MMORPG from the same great studio that brought us Eden Eterna.,https://www.freetogame.com/open/aura-kingdom,MMORPG,PC (Windows),Aeria Games,X-Legend,2013-12-23,https://www.freetogame.com/aura-kingdom
424,Crystal Saga,https://www.freetogame.com/g/424/thumbnail.jpg,A free to play 2D browser-based MMORPG that allows players to explore the land of Vidalia.,https://www.freetogame.com/open/crystal-saga,MMORPG,Web Browser,"Aeria, R2Games",R2Games,2013-11-20,https://www.freetogame.com/crystal-saga
224,World of Warplanes,https://www.freetogame.com/g/224/thumbnail.jpg,A free-to-play flight combat MMO brought to you by Wargaming.,https://www.freetogame.com/open/world-of-warplanes,Shooter,PC (Windows),Wargaming,Wargaming,2013-11-12,https://www.freetogame.com/world-of-warplanes
225,RIFT,https://www.freetogame.com/g/225/thumbnail.jpg,Trion Worlds’ flagship fantasy massively multiplayer online role-playing game.,https://www.freetogame.com/open/rift,MMORPG,PC (Windows),Trion Worlds,Trion Worlds,2013-10-24,https://www.freetogame.com/rift
226,Path of Exile,https://www.freetogame.com/g/226/thumbnail.jpg,A free-to-play massively multiplayer online ARPG in the style of Diablo.,https://www.freetogame.com/open/path-of-exile,MMORPG,PC (Windows),Grinding Gear Games,Grinding Gear Games,2013-10-23,https://www.freetogame.com/path-of-exile
411,Soldiers Inc.,https://www.freetogame.com/g/411/thumbnail.jpg,A free to play 2D top-down browser based MMORTS game.,https://www.freetogame.com/open/soldiers-inc,Strategy,Web Browser,Plarium Games,Plarium Games,2013-08-01,https://www.freetogame.com/soldiers-inc
412,Nords: Heroes of the North,https://www.freetogame.com/g/412/thumbnail.jpg,"A free to play browser-based 2D strategy MMO game with Elves, Orcs, Dragons and more.",https://www.freetogame.com/open/nords-heroes-north,Strategy,Web Browser,Plarium Games,Plarium Games,2013-08-01,https://www.freetogame.com/nords-heroes-north
229,Dota 2,https://www.freetogame.com/g/229/thumbnail.jpg,Valve's premiere competitive free to play MOBA.,https://www.freetogame.com/open/dota-2,MOBA,PC (Windows),Valve,Valve,2013-07-09,https://www.freetogame.com/dota-2
230,Ragnarok Online 2,https://www.freetogame.com/g/230/thumbnail.jpg,"A 3D fantasy MMORPG, and sequel to the popular Ragnarok Online.",https://www.freetogame.com/open/ragnarok-online-2,MMORPG,PC (Windows),Gravity Interactive,"Gravity, Inc.",2013-05-01,https://www.freetogame.com/ragnarok-online-2
231,Panzar,https://www.freetogame.com/g/231/thumbnail.jpg,"A free-to-play multiplayer third-person shooter with 
rpg elements and CryEngine 3 powered 
graphics.",https://www.freetogame.com/open/panzar,MOBA,PC (Windows),Panzar,Troxit Service,2013-04-12,https://www.freetogame.com/panzar
233,Kingdom Wars,https://www.freetogame.com/g/233/thumbnail.jpg,A free to play 3D MMORTS with real-time siege combat.,https://www.freetogame.com/open/kingdom-wars,Strategy,PC (Windows),"Reverie World Studios, INC","Reverie World Studios, INC",2013-04-01,https://www.freetogame.com/kingdom-wars
234,Champions of Regnum,https://www.freetogame.com/g/234/thumbnail.jpg,"A free to play, realm versus realm fantasy MMORPG.",https://www.freetogame.com/open/champions-of-regnum,MMORPG,PC (Windows),NGD Studios,NGD Studios,2013-02-27,https://www.freetogame.com/champions-of-regnum
235,Star Conflict,https://www.freetogame.com/g/235/thumbnail.jpg,A free to play action-packed MMO space simulation game.,https://www.freetogame.com/open/star-conflict,Shooter,PC (Windows),Gaijin Entertainment,Star Gem Inc.,2013-02-28,https://www.freetogame.com/star-conflict
414,Rail Nation,https://www.freetogame.com/g/414/thumbnail.jpg,A free to play 2D browser-based train simulation strategy MMO game.,https://www.freetogame.com/open/rail-nation,Strategy,Web Browser,Bright Future,Travian Games,2013-01-13,https://www.freetogame.com/rail-nation
240,Epic Cards Battle,https://www.freetogame.com/g/240/thumbnail.jpg,A free to play online strategic trading card game with dozens of cards and five factions.,https://www.freetogame.com/open/epic-card-battle,Card Game,PC (Windows),momoStorm Entertainment,momoStorm,2013-01-29,https://www.freetogame.com/epic-card-battle
232,Age of Wushu,https://www.freetogame.com/g/232/thumbnail.jpg,A free-to-play martial arts action MMORPG with a large open world and sandbox-like features.,https://www.freetogame.com/open/age-of-wushu,MMORPG,PC (Windows),Snail Games,Snail Games,2012-12-20,https://www.freetogame.com/age-of-wushu
241,Everquest,https://www.freetogame.com/g/241/thumbnail.jpg,"A fantasy MMORPG nearly two decades in the making. In fact, it’s the game that started it all! ",https://www.freetogame.com/open/everquest,MMORPG,PC (Windows),Daybreak Games,Daybreak Games,2012-12-13,https://www.freetogame.com/everquest
242,Mabinogi,https://www.freetogame.com/g/242/thumbnail.jpg,A free-to-play adventure MMORPG where you can create a unique character and live your fantasy life.,https://www.freetogame.com/open/mabinogi,MMORPG,PC (Windows),Nexon America Inc.,NEXON Korea Corp.,2012-12-06,https://www.freetogame.com/mabinogi
415,Stormfall: Age of War,https://www.freetogame.com/g/415/thumbnail.jpg,"A free to play 2D top-down browser MMORTS featuring castle building, resource management and PvP battles.",https://www.freetogame.com/open/stormfall-age-war,Strategy,Web Browser,Plarium,Plarium,2012-11-01,https://www.freetogame.com/stormfall-age-war
244,AirMech Strike,https://www.freetogame.com/g/244/thumbnail.jpg,A free to play Action RTS with MOBA elements.,https://www.freetogame.com/open/airmech,Strategy,PC (Windows),Carbon Games,Carbon Games,2012-11-08,https://www.freetogame.com/airmech
349,Big Farm,https://www.freetogame.com/g/349/thumbnail.jpg,A friendly browser-based farming simulation MMO game!,https://www.freetogame.com/open/big-farm,Strategy,Web Browser,GoodGame Studios,GoodGame Studios,2012-10-29,https://www.freetogame.com/big-farm
416,Wartune,https://www.freetogame.com/g/416/thumbnail.jpg,A 2D browser-based Strategy MMORPG with classic turn based RPG features.,https://www.freetogame.com/open/wartune,MMORPG,Web Browser,R2 Games,7Th Road,2012-10-25,https://www.freetogame.com/wartune
246,Pirate 101,https://www.freetogame.com/g/246/thumbnail.jpg,A free to play Pirate-themed MMORPG designed with kids in mind.,https://www.freetogame.com/open/pirate-101,MMORPG,PC (Windows),KingsIsle Entertainment,KingsIsle Entertainment,2012-10-15,https://www.freetogame.com/pirate-101
417,Dino Storm,https://www.freetogame.com/g/417/thumbnail.jpg,"A free-to-play 3D MMO with cowboys, dinosaurs, and laser guns.",https://www.freetogame.com/open/dino-storm,MMORPG,Web Browser,Splitscreen S.,Splits. S,2012-09-12,https://www.freetogame.com/dino-storm
418,The Settlers Online,https://www.freetogame.com/g/418/thumbnail.jpg,A free to play city building MMORTS based on the popular Settlers series.,https://www.freetogame.com/open/the-settlers-online,Strategy,Web Browser,Ubisoft,Blue Byte,2012-09-11,https://www.freetogame.com/the-settlers-online
248,Continent of the Ninth Seal,https://www.freetogame.com/g/248/thumbnail.jpg,A free MMORPG where players take part as heroes of Glenheim to stand together against Nefer.,https://www.freetogame.com/open/c9,MMORPG,PC (Windows),Webzen,NHN Games (Acquired by Webzen),2012-09-13,https://www.freetogame.com/c9
24,Counter-Strike: Global Offensive,https://www.freetogame.com/g/24/thumbnail.jpg,The popular multiplayer shooter from Valve.,https://www.freetogame.com/open/counter-strike-global-offensive,Shooter,PC (Windows),Valve,"Valve, Hidden Path Entertainment",2012-08-21,https://www.freetogame.com/counter-strike-global-offensive
453,Gotham City Impostors,https://www.freetogame.com/g/453/thumbnail.jpg,A free to play multiplayer FPS that pits vigilantes dressed up like Batman against criminals dressed up like the Joker,https://www.freetogame.com/open/gotham-city-impostors,Shooter,PC (Windows),Warner Bros. Interactive Entertainment,"Monolith Productions, Inc.",2012-08-31,https://www.freetogame.com/gotham-city-impostors
249,RPG MO,https://www.freetogame.com/g/249/thumbnail.jpg,A nostalgic free MMORPG reminiscent of old-school RPG's like Ultima and Runescape.,https://www.freetogame.com/open/rpg-mo,MMORPG,"PC (Windows), Web Browser",Marxnet,Marxnet,2012-07-18,https://www.freetogame.com/rpg-mo
256,Realm of the Mad God,https://www.freetogame.com/g/256/thumbnail.jpg,A fast paced 2d free to play MMO shooter game with a retro 8-bit style.,https://www.freetogame.com/open/realm-mad-god,MMORPG,"PC (Windows), Web Browser",Kabam,Wild Shadow Studios,2012-02-21,https://www.freetogame.com/realm-mad-god
422,Pirates: Tides of Fortune,https://www.freetogame.com/g/422/thumbnail.jpg,A free to play browser-based 2D MMORTS for people who are fans of pirates!,https://www.freetogame.com/open/pirates-tides-fortune,Strategy,Web Browser,Plarium Games,Plarium Games,2012-02-12,https://www.freetogame.com/pirates-tides-fortune
255,Stronghold Kingdoms,https://www.freetogame.com/g/255/thumbnail.jpg,A strategy based building/warfare game based on the long running Strongholds PC game series.,https://www.freetogame.com/open/stronghold-kingdoms,Strategy,Web Browser,FireFly Studios,FireFly Studios,2012-02-28,https://www.freetogame.com/stronghold-kingdoms
257,Star Wars: The Old Republic,https://www.freetogame.com/g/257/thumbnail.jpg,A 3D sci-fi MMORPG based on the popular Star Wars universe and brought to you by Bioware.,https://www.freetogame.com/open/swtor,MMORPG,PC (Windows),Electronic Arts,Bioware,2011-12-20,https://www.freetogame.com/swtor
292,5Street,https://www.freetogame.com/g/292/thumbnail.jpg,A free-to-play dancing MMO and a unique social experience.,https://www.freetogame.com/open/5street,Social,PC (Windows),Snail Games,Snail Games,2011-11-11,https://www.freetogame.com/5street
261,No More Room in Hell,https://www.freetogame.com/g/261/thumbnail.jpg,A free to play cooperative FPS survival horror mod for the Source Engine.,https://www.freetogame.com/open/no-more-room-in-hell,Shooter,PC (Windows),Lever Games,No More Room in Hell Team,2011-10-31,https://www.freetogame.com/no-more-room-in-hell
262,Digimon Masters Online,https://www.freetogame.com/g/262/thumbnail.jpg,A free to play 3D MMORPG based on the popular Digimon franchise.,https://www.freetogame.com/open/digimon-masters-online,MMORPG,PC (Windows),MOVE ON USA CO.,"Move Games Co., Ltd.",2011-10-20,https://www.freetogame.com/digimon-masters-online
264,Dragon Nest,https://www.freetogame.com/g/264/thumbnail.jpg,A free-to-play action MMORPG with non-targeting combat.,https://www.freetogame.com/open/dragon-nest,MMORPG,PC (Windows),Eyedentity Games Inc.,Eyedentity Games Inc.,2011-09-28,https://www.freetogame.com/dragon-nest
350,Goodgame Empire,https://www.freetogame.com/g/350/thumbnail.jpg,A free to play medieval strategy browser game. Build you own castle and create a powerful army!,https://www.freetogame.com/open/goodgame-empire,Strategy,Web Browser,Goodgame Studios,Goodgame Studios,2011-08-14,https://www.freetogame.com/goodgame-empire
267,Mission Against Terror,https://www.freetogame.com/g/267/thumbnail.jpg,A free to play fast-paced lobby-based MMOFPS with lots of game modes and tons of weapons.,https://www.freetogame.com/open/mat,Shooter,PC (Windows),Suba Games,Kingsoft,2011-07-08,https://www.freetogame.com/mat
269,Spiral Knights,https://www.freetogame.com/g/269/thumbnail.jpg,"A massively multiplayer online role-playing game, battle monsters and collect treasures!",https://www.freetogame.com/open/spiral-knights,MMORPG,PC (Windows),SEGA,Three Rings,2011-06-15,https://www.freetogame.com/spiral-knights
423,Steel Legions,https://www.freetogame.com/g/423/thumbnail.jpg,A free to play 3d browser based tank game with fast-paced tactical battles!,https://www.freetogame.com/open/steel-legions,Shooter,Web Browser,Splitscreen Studios,Splitscreen Studios,2011-06-15,https://www.freetogame.com/steel-legions
271,Asda Global,https://www.freetogame.com/g/271/thumbnail.jpg,A 3D anime-inspired fantasy MMORPG and is the successor to the original Asda Story.,https://www.freetogame.com/open/asda-global,MMORPG,PC (Windows),GamenGame,Maxonsoft,2011-05-19,https://www.freetogame.com/asda-global
60,Brink,https://www.freetogame.com/g/60/thumbnail.jpg,"A free-to-play first-person-shoot developed by Splash 
Damage and published by Bethesda Softworks. ",https://www.freetogame.com/open/brink,Shooter,PC (Windows),Bethesda Softworks,Splash Damage,2011-05-09,https://www.freetogame.com/brink
272,Allods Online,https://www.freetogame.com/g/272/thumbnail.jpg,A fantasy MMORPG that follows more traditional “World of Warcraft-like” MMO traditions.,https://www.freetogame.com/open/allods-online,MMORPG,PC (Windows),My.com,Allods Team,2011-04-26,https://www.freetogame.com/allods-online
205,Elsword,https://www.freetogame.com/g/205/thumbnail.jpg,A Free to Play 3D side scrolling action MMORPG with many heroes.,https://www.freetogame.com/open/elsword,MMORPG,PC (Windows),KOG Games,KOG,2011-03-23,https://www.freetogame.com/elsword
260,DC Universe Online,https://www.freetogame.com/g/260/thumbnail.jpg,"A free-to-play, comics based MMORPG set in the popular DC Comics universe.",https://www.freetogame.com/open/dcuo,MMORPG,PC (Windows),Daybreak Games,Daybreak Games,2011-01-11,https://www.freetogame.com/dcuo
273,Bloodline Champions,https://www.freetogame.com/g/273/thumbnail.jpg,Free-to-Play Moba game where players engage in short battles of up to ten players divided into two teams.,https://www.freetogame.com/open/bloodline-champions,MOBA,PC (Windows),Stunlock Studios,Stunlock Studios,2011-01-13,https://www.freetogame.com/bloodline-champions
274,GetAmped 2,https://www.freetogame.com/g/274/thumbnail.jpg,"A free to play fighting MMO, experience frantic battles up to 20 players.",https://www.freetogame.com/open/getamped-2,Fighting,PC (Windows),CyberStep,CyberStep,2010-12-16,https://www.freetogame.com/getamped-2
275,Dragon Saga,https://www.freetogame.com/g/275/thumbnail.jpg,A free to play arcade­-style side­-scrolling 3D MMORPG.,https://www.freetogame.com/open/dragon-saga,MMORPG,PC (Windows),Gravity Interactive,Gravity Interactive,2010-10-28,https://www.freetogame.com/dragon-saga
276,Vindictus,https://www.freetogame.com/g/276/thumbnail.jpg,A free to play action MMO game with beautiful graphics and intense battles.,https://www.freetogame.com/open/vindictus,MMORPG,PC (Windows),Nexon,devCAT,2010-10-13,https://www.freetogame.com/vindictus
277,Aika Online,https://www.freetogame.com/g/277/thumbnail.jpg,A free-to-play MMORPG with large scale PvP battles.,https://www.freetogame.com/open/aika-online,MMORPG,PC (Windows),HanbitSoft,JoyImpact,2010-08-27,https://www.freetogame.com/aika-online
258,APB Reloaded,https://www.freetogame.com/g/258/thumbnail.jpg,A free to play 3D MMO third person shooter game brought to you by GTA creator.,https://www.freetogame.com/open/apb,Shooter,PC (Windows),Reloaded Games,Reloaded Productions,2010-06-29,https://www.freetogame.com/apb
278,Mortal Online,https://www.freetogame.com/g/278/thumbnail.jpg,A unique free to play First Person sandbox MMORPG.,https://www.freetogame.com/open/mortal-online,MMORPG,PC (Windows),Star Vault AB,Star Vault AB,2010-06-09,https://www.freetogame.com/mortal-online
281,Grand Fantasia,https://www.freetogame.com/g/281/thumbnail.jpg,"A free to play anime inspired 3D MMORPG with customizable characters and 
companions.",https://www.freetogame.com/open/grand-fantasia,MMORPG,PC (Windows),Aeria Games,X-Legend Entertainment,2009-12-01,https://www.freetogame.com/grand-fantasia
425,Grepolis,https://www.freetogame.com/g/425/thumbnail.jpg,A free to play browser-based strategy MMORTS set in Ancient Greece.,https://www.freetogame.com/open/grepolis,Strategy,Web Browser,InnoGames,InnoGames,2009-12-08,https://www.freetogame.com/grepolis
286,League of Legends,https://www.freetogame.com/g/286/thumbnail.jpg,"A free-to-play MOBA game, and one of the most played pc game in the world.",https://www.freetogame.com/open/league-of-legends,MOBA,PC (Windows),Riot Games,Riot Games,2009-10-27,https://www.freetogame.com/league-of-legends
287,Twelve Sky 2,https://www.freetogame.com/g/287/thumbnail.jpg,There’s a lot of world to explore in this fantasy MMORPG!,https://www.freetogame.com/open/twelve-sky-2,MMORPG,PC (Windows),RedFox Games,SG Data,2009-09-09,https://www.freetogame.com/twelve-sky-2
288,Champions Online,https://www.freetogame.com/g/288/thumbnail.jpg,A superhero MMORPG created by the same studio behind City of Heroes.,https://www.freetogame.com/open/champions-online,MMORPG,PC (Windows),Perfect World Entertainment,Cryptic Studios,2009-09-01,https://www.freetogame.com/champions-online
402,Might And Magic Heroes Online,https://www.freetogame.com/g/402/thumbnail.jpg,A free-to-play MMO strategy RPG game in which you control powerful Heroes!,https://www.freetogame.com/open/might-magic-heroes-online,MMORPG,Web Browser,Ubisoft,"Ubisoft Blue Byte, Related Designs",2009-09-03,https://www.freetogame.com/might-magic-heroes-online
280,WolfTeam,https://www.freetogame.com/g/280/thumbnail.jpg,A free to play MMOFPS with a twist.,https://www.freetogame.com/open/wolfteam,Shooter,PC (Windows),Aeria Games,Softnyx,2009-07-09,https://www.freetogame.com/wolfteam
290,Runes of Magic,https://www.freetogame.com/g/290/thumbnail.jpg,A free-to-play fantasy 3D MMORPG set in the fantasy world of Taborea.,https://www.freetogame.com/open/runes-of-magic,MMORPG,PC (Windows),GameForge,Runewalker Entertainment,2009-03-19,https://www.freetogame.com/runes-of-magic
291,theHunter,https://www.freetogame.com/g/291/thumbnail.jpg,An MMO shooter where players can hunt 22 different animals in various locations.,https://www.freetogame.com/open/thehunter,Shooter,PC (Windows),"Expansive Worlds , Avalanche Studios","Expansive Worlds , Avalanche Studios",2009-03-05,https://www.freetogame.com/thehunter
254,AION,https://www.freetogame.com/g/254/thumbnail.jpg,"A high fantasy, free-to-play MMORPG that centers on the war between the game’s two factions: The Asmodians and the Elyos.",https://www.freetogame.com/open/aion,MMORPG,PC (Windows),NCSOFT,NCSOFT,2008-11-25,https://www.freetogame.com/aion
293,Atlantica Online,https://www.freetogame.com/g/293/thumbnail.jpg,A free-to-play 3D tactical massively multiplayer online role-playing game.,https://www.freetogame.com/open/atlantica-online,MMORPG,PC (Windows),VALOFE,NDOORS Corporation,2008-10-30,https://www.freetogame.com/atlantica-online
295,Florensia,https://www.freetogame.com/g/295/thumbnail.jpg,"A free to play fantasy MMORPG with legendary worlds ashore and at 
sea.",https://www.freetogame.com/open/florensia,MMORPG,PC (Windows),Netts Corporation,Netts Corporation,2008-10-15,https://www.freetogame.com/florensia
306,4Story,https://www.freetogame.com/g/306/thumbnail.jpg,"A enjoyable MMORPG where you can customize your character, join guilds and battle other factions.",https://www.freetogame.com/open/4story,MMORPG,PC (Windows),Zemi Interactive,Zemi Interactive,2008-10-20,https://www.freetogame.com/4story
426,AdventureQuest Worlds,https://www.freetogame.com/g/426/thumbnail.jpg,A free-to-play 2D fantasy browser MMORPG. There are no downloads or software to install!,https://www.freetogame.com/open/adventurequest-worlds,MMORPG,Web Browser,Artix Entertainment,Artix Entertainment,2008-10-10,https://www.freetogame.com/adventurequest-worlds
297,Wizard101,https://www.freetogame.com/g/297/thumbnail.jpg,A free to play MMORPG set in the magical Wizard school.,https://www.freetogame.com/open/wizard101,MMORPG,PC (Windows),KingsIsle Entertainment,KingsIsle Entertainment,2008-09-02,https://www.freetogame.com/wizard101
298,Perfect World International,https://www.freetogame.com/g/298/thumbnail.jpg,"A free-to-play fantasy MMORPG, that focuses heavily on Chinese mythology.",https://www.freetogame.com/open/pwi,MMORPG,PC (Windows),"Beijing Perfect World, Perfect World Entertainment",Beijing Perfect World,2008-09-02,https://www.freetogame.com/pwi
319,Ace Online,https://www.freetogame.com/g/319/thumbnail.jpg,A free to play fast action 3D sci-fi MMO where players control space fighters jets.,https://www.freetogame.com/open/ace-online,Shooter,PC (Windows),Suba Games,MasangSoft,2008-08-29,https://www.freetogame.com/ace-online
300,Rohan: Blood Feud,https://www.freetogame.com/g/300/thumbnail.jpg,A free-to-play medieval MMORPG highly-focused on PVP.,https://www.freetogame.com/open/rohan-blood-feud,MMORPG,PC (Windows),Playwith Interactive,Playwith Interactive,2008-05-28,https://www.freetogame.com/rohan-blood-feud
301,Age of Conan: Unchained,https://www.freetogame.com/g/301/thumbnail.jpg,A award ­winning massively multiplayer online game that has received critical acclaim.,https://www.freetogame.com/open/age-of-conan,MMORPG,PC (Windows),Funcom,Funcom,2008-05-20,https://www.freetogame.com/age-of-conan
428,Ikariam,https://www.freetogame.com/g/428/thumbnail.jpg,A free to play browser-based city-building strategy game by GameForge.,https://www.freetogame.com/open/ikariam,Strategy,Web Browser,GameForge,GameForge,2008-03-31,https://www.freetogame.com/ikariam
303,Saga,https://www.freetogame.com/g/303/thumbnail.jpg,A free-to-play MMORTS that also features city-building and trading card games.,https://www.freetogame.com/open/saga,Strategy,PC (Windows),Silverlode Interactive,"Silverlode Interactive , Wasatch Games",2008-02-26,https://www.freetogame.com/saga
305,Fiesta Online,https://www.freetogame.com/g/305/thumbnail.jpg,A free to play anime MMORPG with a friendly community.,https://www.freetogame.com/open/fiesta-online,MMORPG,PC (Windows),gamigo AG,Onson Soft,2008-02-01,https://www.freetogame.com/fiesta-online
307,Shaiya,https://www.freetogame.com/g/307/thumbnail.jpg,A free to play 3D MMORPG similar to World of Warcraft and Lineage 2.,https://www.freetogame.com/open/shaiya,MMORPG,PC (Windows),Aeria Games,Aeria Games,2007-12-24,https://www.freetogame.com/shaiya
308,Angels Online,https://www.freetogame.com/g/308/thumbnail.jpg,A cute anime MMORPG with a good selection of classes.,https://www.freetogame.com/open/angels-online,MMORPG,PC (Windows),I Got Games,UserJoy Technology,2007-12-01,https://www.freetogame.com/angels-online
309,Seal Online,https://www.freetogame.com/g/309/thumbnail.jpg,A free MMORP that has been out for a long period of time with solid history under its belt.,https://www.freetogame.com/open/seal-online,MMORPG,PC (Windows),YNK Interactive,YNK Interactive,2007-11-19,https://www.freetogame.com/seal-online
310,Team Fortress 2,https://www.freetogame.com/g/310/thumbnail.jpg,Valve's iconic class-based free-to-play first-person shooter!,https://www.freetogame.com/open/team-fortress-2,Shooter,PC (Windows),Valve,Valve,2007-10-10,https://www.freetogame.com/team-fortress-2
311,Rumble Fighter,https://www.freetogame.com/g/311/thumbnail.jpg,"A free to play Fighting MMO, test your skills!",https://www.freetogame.com/open/rumble-fighter,Fighting,PC (Windows),RedFox Games,Nimonix,2007-08-02,https://www.freetogame.com/rumble-fighter
312,Granado Espada Online,https://www.freetogame.com/g/312/thumbnail.jpg,"Adventure back to colonial times where you can find prestige, wealth, adventure, and a lot of work.",https://www.freetogame.com/open/granado-espada,MMORPG,PC (Windows),T3Fun,IMC Games Co. Limited,2007-07-10,https://www.freetogame.com/granado-espada
265,9Dragons,https://www.freetogame.com/g/265/thumbnail.jpg,A martial arts themed MMORPG set in China during the Ming Dynasty.,https://www.freetogame.com/open/9dragons,MMORPG,PC (Windows),Battlezone,JoongWon Games,2007-05-09,https://www.freetogame.com/9dragons
15,Crossfire,https://www.freetogame.com/g/15/thumbnail.jpg,A first person tactical shooter with a huge selection of game modes!,https://www.freetogame.com/open/crossfire,Shooter,PC (Windows),Neowiz Games,SmileGate,2007-05-03,https://www.freetogame.com/crossfire
