id,title,thumbnail,short_description,game_url,genre,platform,publisher,developer,release_date,freetogame_profile_url
461,Shop Titans,https://www.freetogame.com/g/461/thumbnail.jpg,A free-to-play RPG shopkeeper simulation game where you are responsible for designing and maintaining your own shop.,https://www.freetogame.com/open/shop-titans,Strategy,PC (Windows),"Kabam Games, Inc.","Kabam Games, Inc.",2020-05-05,https://www.freetogame.com/shop-titans
463,Survivor Legacy,https://www.freetogame.com/g/463/thumbnail.jpg,Survivor Legacy is a free-to-play zombie-themed strategy game from R2 Games.,https://www.freetogame.com/open/survivor-legacy,Strategy,Web Browser,R2 Games,GameHollywood,2020-04-07,https://www.freetogame.com/survivor-legacy
459,Bombergrounds: Battle Royale,https://www.freetogame.com/g/459/thumbnail.jpg,A free-to-play massively multiplayer battle Royale game inspired by the old-shool Bomberman games!,https://www.freetogame.com/open/bombergrounds-battle-royale,Battle Royale,PC (Windows),Giant Duck Games,Giant Duck Games,2020-03-07,https://www.freetogame.com/bombergrounds-battle-royale
39,Darwin Project,https://www.freetogame.com/g/39/thumbnail.jpg,A free-to-play 10-player battle royale game set just prior to an impeding ice age.,https://www.freetogame.com/open/darwin-project,Shooter,PC (Windows),Scavengers Studio,Scavengers Studio,2020-01-14,https://www.freetogame.com/darwin-project
441,Legends of Runeterra,https://www.freetogame.com/g/441/thumbnail.jpg,A free-to-play CCG based on Riot Games' MOBA League of Legends.,https://www.freetogame.com/open/runeterra,Card Game,PC (Windows),Riot Games,Riot Games,2020-01-24,https://www.freetogame.com/runeterra
4,CRSED: F.O.A.D.,https://www.freetogame.com/g/4/thumbnail.jpg,Take the battle royale genre and add  mystical powers and you have CRSED: F.O.A.D. (Aka Cuisine Royale: Second Edition),https://www.freetogame.com/open/crsed,Shooter,PC (Windows),Gaijin Distribution KFT,Darkflow Software,2019-12-12,https://www.freetogame.com/crsed
535,Mirage Online Classic,https://www.freetogame.com/g/535/thumbnail.jpg,A browser-based free-to-play spiritual successor to 2001's Mirage Online.,https://www.freetogame.com/open/mirage-online-classic,MMORPG,Web Browser,Retrelon Games,Retrelon Games,2019-12-24,https://www.freetogame.com/mirage-online-classic
436,Inferna,https://www.freetogame.com/g/436/thumbnail.jpg,"A cross-platform MMO from indie developer and publisher Inferna Limited, designed for players seeking a classic experience.  ",https://www.freetogame.com/open/inferna,MMORPG,PC (Windows),INFERNA LIMITED,INFERNA LIMITED,2019-12-21,https://www.freetogame.com/inferna
443,Ultimate Pirates,https://www.freetogame.com/g/443/thumbnail.jpg,A browser-based strategy MMO published for both desktop and mobile browsers by Gameforge.,https://www.freetogame.com/open/ultimate-pirates,Strategy,Web Browser,Gameforge,Moonmana,2019-12-02,https://www.freetogame.com/ultimate-pirates
501,Fer.al,https://www.freetogame.com/g/501/thumbnail.jpg,"If you’ve ever wanted to be a creature of myth and hang out with other mytical creatures, Wildworks’ Fer.al can help you live the dream.",https://www.freetogame.com/open/Feral,MMO,PC (Windows),Wildworks,Wildworks,2019-12-13,https://www.freetogame.com/Feral
435,Battle Breakers,https://www.freetogame.com/g/435/thumbnail.jpg,A multi-platform free-to-play RPG developed and published by Epic Games for PC and Android devices.,https://www.freetogame.com/open/battlebreakers,Strategy,PC (Windows),Epic Games,Epic Games,2019-11-13,https://www.freetogame.com/battlebreakers
437,Stay Out,https://www.freetogame.com/g/437/thumbnail.jpg,An MMORPG featuring urban exploration and shooter elements.,https://www.freetogame.com/open/stay-out,Shooter,PC (Windows),Mobile Technologies LLC,Mobile Technologies LLC,2019-11-27,https://www.freetogame.com/stay-out
439,PC Futbol Legends,https://www.freetogame.com/g/439/thumbnail.jpg,An arcade soccer game inspired by cult arcade games from IDC games.,https://www.freetogame.com/open/futbol-legends,Sports,PC (Windows),IDG GAmes,IDG GAmes,2019-11-01,https://www.freetogame.com/futbol-legends
440,Vampire Empire,https://www.freetogame.com/g/440/thumbnail.jpg,A multiplayer strategy game that focuses on the war between vampires and werewolves.,https://www.freetogame.com/open/vampire-empire,Strategy,Web Browser,R2 Games,F5 Game Company,2019-11-07,https://www.freetogame.com/vampire-empire
468,Firestone Idle RPG,https://www.freetogame.com/g/468/thumbnail.jpg,"Set in the fantasy world of Alandria, Firestone is an idle RPG in which players are tasked with building the best possible party of heroes and using them to defeat the undead and orcs that plague the world.",https://www.freetogame.com/open/firestone-idle-rpg,Strategy,Web Browser,Holyday Studios,Holyday Studios,2019-09-26,https://www.freetogame.com/firestone-idle-rpg
505,Mythgard,https://www.freetogame.com/g/505/thumbnail.jpg,"Rhino Games Inc.’s CCG Mythgard combines cyberpunk with the heroes, gods, and creatures of the fantasy in a modern setting to create a world where magic competes against technology for control.",https://www.freetogame.com/open/mythgard,Card Game,PC (Windows),Rhino Games Inc.,Rhino Games Inc.,2019-09-18,https://www.freetogame.com/mythgard
446,Legends of Aria,https://www.freetogame.com/g/446/thumbnail.jpg,"A sandbox MMORPG featuring a skill-based system, content that will appeal to both PvE and PvP players, and a robust housing system.",https://www.freetogame.com/open/legends-of-aria,MMORPG,PC (Windows),Citadel Studios Inc,Citadel Studios Inc,2019-08-07,https://www.freetogame.com/legends-of-aria
451,Crystal Clash,https://www.freetogame.com/g/451/thumbnail.jpg,A free-to-play fantasy RTS developed by Crunchy Leaf Games.,https://www.freetogame.com/open/crystal-clash,Strategy,PC (Windows),Crunchy Leaf Games,Crunchy Leaf Games,2019-08-30,https://www.freetogame.com/crystal-clash
447,Dota Underlords,https://www.freetogame.com/g/447/thumbnail.jpg,A free-to-play auto battler strategy game set in the world of Valve's Dota franchise.,https://www.freetogame.com/open/dota-underlords,Strategy,PC (Windows),Valve,Valve,2019-06-21,https://www.freetogame.com/dota-underlords
19,Minion Masters,https://www.freetogame.com/g/19/thumbnail.jpg,A free-to-play strategic minion brawler from Danish developer Betadwarf.,https://www.freetogame.com/open/minion-masters,Card Game,PC (Windows),Betadwarf,Betadwarf,2019-05-24,https://www.freetogame.com/minion-masters
20,Splitgate: Arena Warfare,https://www.freetogame.com/g/20/thumbnail.jpg,A free-to-play multiplayer shooter developed and published by 1047 games.,https://www.freetogame.com/open/splitgate-arena-warfare,Shooter,PC (Windows),1047 Games,1047 Games,2019-05-22,https://www.freetogame.com/splitgate-arena-warfare
456,Conqueror's Blade,https://www.freetogame.com/g/456/thumbnail.jpg,"Command your own medieval army in Conqueror's Blade, a war simulator developed by Booming games.",https://www.freetogame.com/open/conquerors-blade,Strategy,PC (Windows),Booming Games,Booming Games,2019-05-30,https://www.freetogame.com/conquerors-blade
353,Stein.world,https://www.freetogame.com/g/353/thumbnail.jpg,"A free-to-play, browser-based online fantasy role 
playing game done in an old-school 
16-bit style.",https://www.freetogame.com/open/steinworld,MMORPG,Web Browser,PG5-Studio UG,PG5-Studio UG,2019-04-24,https://www.freetogame.com/steinworld
438,Kards,https://www.freetogame.com/g/438/thumbnail.jpg,A free-to-play collectible World War II card game from developer 1939 Games.,https://www.freetogame.com/open/kards,Card Game,PC (Windows),1939 Games,1939 Games,2019-04-12,https://www.freetogame.com/kards
448,KurtzPel,https://www.freetogame.com/g/448/thumbnail.jpg,A free-to-play third-person action battle game from KOG Games.,https://www.freetogame.com/open/kurtzpel,Fighting,PC (Windows),KOG,KOG,2019-04-30,https://www.freetogame.com/kurtzpel
457,The Third Age,https://www.freetogame.com/g/457/thumbnail.jpg,A free-to-play browser-based Strategy MMO game focused on story-based PvE gameplay!,https://www.freetogame.com/open/the-third-age,Strategy,Web Browser,R2 Games,R2 Games,2019-04-29,https://www.freetogame.com/the-third-age
91,Eternal,https://www.freetogame.com/g/91/thumbnail.jpg,"A strategy card game designed to take the best elements of Magic the Gathering, Hearthstone, and Hex and combine them all into one game.",https://www.freetogame.com/open/eternal,Card Game,PC (Windows),Dire Wolf Digital,Dire Wolf Digital,2018-11-15,https://www.freetogame.com/eternal
503,Artifact,https://www.freetogame.com/g/503/thumbnail.jpg,"Valve’s Artifact is two games in one. Whether you’re looking for the original Dota 2 trading card game created with the help of card game designer Richard Garfield or something a little more streamlined, Artifact has both in one download.",https://www.freetogame.com/open/artifact,Card Game,PC (Windows),Valve,Valve,2018-11-29,https://www.freetogame.com/artifact
538,World War 3,https://www.freetogame.com/g/538/thumbnail.jpg,A realistic multiplayer tactical FPS.,https://www.freetogame.com/open/world-war-3,Shooter,PC (Windows),"Wishlist Games, The 4 Winds Entertainment",The Farm 51,2018-10-19,https://www.freetogame.com/world-war-3
299,Combat Arms: Reloaded,https://www.freetogame.com/g/299/thumbnail.jpg,A free to play modern first person shooter with lots of maps and weapons!,https://www.freetogame.com/open/combat-arms,Shooter,PC (Windows),"VALOFE, NEXON",Doobic Studios,2018-10-31,https://www.freetogame.com/combat-arms
68,Dreadnought,https://www.freetogame.com/g/68/thumbnail.jpg,A free-to-play combat flight simulator developed by Yager Development and published by Grey Box.,https://www.freetogame.com/open/dreadnought,Shooter,PC (Windows),Grey Box,Yager Development,2018-10-14,https://www.freetogame.com/dreadnought
28,Spacelords,https://www.freetogame.com/g/28/thumbnail.jpg,A free-to-play 4v1 sci-fi shooter.,https://www.freetogame.com/open/spacelords,Shooter,PC (Windows),MercurySteam Entertainment,MercurySteam,2018-09-22,https://www.freetogame.com/spacelords
29,Ring of Elysium,https://www.freetogame.com/g/29/thumbnail.jpg,A free-to-play battle royale developed and published by Tencent Games.,https://www.freetogame.com/open/ring-of-elysium,Shooter,PC (Windows),Tencent Games,Tencent Games,2018-09-19,https://www.freetogame.com/ring-of-elysium
450,Battlerite Royale,https://www.freetogame.com/g/450/thumbnail.jpg,A free to play battle royale set in the Battlerite universe.,https://www.freetogame.com/open/battlerite-royale,MOBA,PC (Windows),Stunlock Studios,Stunlock Studios,2018-09-26,https://www.freetogame.com/battlerite-royale
454,Magic: The Gathering Arena,https://www.freetogame.com/g/454/thumbnail.jpg,A free-to-play digital recreation of Wizards of the Coast's popular collectible card game.,https://www.freetogame.com/open/mtg-arena,Card Game,PC (Windows),Wizards of the Coast,Wizards of the Coast,2018-09-27,https://www.freetogame.com/mtg-arena
341,League of Angels 3,https://www.freetogame.com/g/341/thumbnail.jpg,"A free-to-play turn-based strategy browser game developed and published by GTArcade Entertainment, Inc.",https://www.freetogame.com/open/league-of-angels-3,MMORPG,Web Browser,GTArcade Entertainment,GTArcade Entertainment,2018-08-14,https://www.freetogame.com/league-of-angels-3
282,BlackShot: Revolution,https://www.freetogame.com/g/282/thumbnail.jpg,Get thrown into the fast-paced action of a virtual war zone and compete against other players.,https://www.freetogame.com/open/blackshot,Shooter,PC (Windows),Papaya Play,Vertigo Games,2018-07-27,https://www.freetogame.com/blackshot
31,Cosmos Invictus,https://www.freetogame.com/g/31/thumbnail.jpg,A strategic collectible card game developed and published by Pegnio Ltd.,https://www.freetogame.com/open/cosmos-invictus,Card Game,PC (Windows),Pegnio Ltd,Pegnio Ltd,2018-06-27,https://www.freetogame.com/cosmos-invictus
36,Realm Royale Reforged,https://www.freetogame.com/g/36/thumbnail.jpg,A free-to-play fantasy-themed battle royale game based on Hi-Rez Studio's team shooter Paladins.,https://www.freetogame.com/open/realm-royale,Shooter,PC (Windows),Hi-Rez Studios,Hi-Rez Studios,2018-06-05,https://www.freetogame.com/realm-royale
460,Empire: World War 3,https://www.freetogame.com/g/460/thumbnail.jpg,A free-to-play browser-based action packed strategy game from the developer of Legends of Honor.,https://www.freetogame.com/open/empireww3,Strategy,Web Browser,Goodgame Studios,Goodgame Studios,2018-06-28,https://www.freetogame.com/empireww3
506,Totally Accurate Battlegrounds,https://www.freetogame.com/g/506/thumbnail.jpg,"Take 60 players, throw them on a map together with over 90 weapons, including balloon crossbows, pots and pans, and inflatable hammers, add physics-based parkour and you have Landfall’s Totally Accurate Battlegrounds (TABG).",https://www.freetogame.com/open/tabg,Shooter,PC (Windows),Landfall,Landfall,2018-06-06,https://www.freetogame.com/tabg
434,Will To Live,https://www.freetogame.com/g/434/thumbnail.jpg,A free-to-play MMORPG-shooter developed and published by AlphaSoft LLC.,https://www.freetogame.com/open/will-to-live,MMORPG,PC (Windows),AlphaSoft LLC,AlphaSoft LLC,2018-04-05,https://www.freetogame.com/will-to-live
543,Battle Arena Heroes Adventure,https://www.freetogame.com/g/543/thumbnail.jpg,A MOBA with RPG elements.,https://www.freetogame.com/open/battle-arena-heroes-adventure,Strategy,Web Browser,Espirit Games,Espirit Games,2018-03-19,https://www.freetogame.com/battle-arena-heroes-adventure
42,Spellsworn,https://www.freetogame.com/g/42/thumbnail.jpg,A free-to-play arena battle game developed and published by Frogsong Studios AB.,https://www.freetogame.com/open/spellsworn,MOBA,PC (Windows),Frogsong Studios AB,Frogsong Studios AB,2018-03-13,https://www.freetogame.com/spellsworn
43,Z1 Battle Royale,https://www.freetogame.com/g/43/thumbnail.jpg,A highly competitive free-to-play battle royale shooter.,https://www.freetogame.com/open/z1-battle-royale,Shooter,PC (Windows),Daybreak Game Company,Daybreak Game Company,2018-02-28,https://www.freetogame.com/z1-battle-royale
44,Tale Of Toast,https://www.freetogame.com/g/44/thumbnail.jpg,"A free-to-play open world MMO inspired by classic, core MMOs. ",https://www.freetogame.com/open/tale-of-toast,MMORPG,PC (Windows),Toasty Leaf AB,Toasty Leaf AB,2018-02-23,https://www.freetogame.com/tale-of-toast
47,Bombtag,https://www.freetogame.com/g/47/thumbnail.jpg,A free-to-play multiplayer Bomberman-inspired game.,https://www.freetogame.com/open/bombtag,Strategy,PC (Windows),David Schneider,David Schneider,2018-02-12,https://www.freetogame.com/bombtag
48,Ironsight,https://www.freetogame.com/g/48/thumbnail.jpg,A free-to-play futuristic shooter published by Aeria Games.,https://www.freetogame.com/open/ironsight,Shooter,PC (Windows),Aeria Games,Wiple Games,2018-02-01,https://www.freetogame.com/ironsight
49,Dead Maze,https://www.freetogame.com/g/49/thumbnail.jpg,A free-to-play 2D isometric MMO full of zombies.,https://www.freetogame.com/open/dead-maze,MMORPG,PC (Windows),801,801,2018-02-13,https://www.freetogame.com/dead-maze
316,Scions of Fate,https://www.freetogame.com/g/316/thumbnail.jpg,A friendly free to play MMORPG with easy to pick up controls.,https://www.freetogame.com/open/scions-of-fate,MMORPG,PC (Windows),NETGAME Inc,MGAME Corporation,2018-01-30,https://www.freetogame.com/scions-of-fate
342,My Soul,https://www.freetogame.com/g/342/thumbnail.jpg,A free-to-play ARPG distributed by GameSpirit.,https://www.freetogame.com/open/my-soul,MMORPG,Web Browser,Gamesprite,Gamesprite,2018-01-01,https://www.freetogame.com/my-soul
22,Wild Terra Online,https://www.freetogame.com/g/22/thumbnail.jpg,A medieval sandbox MMO designed with core players in mind.,https://www.freetogame.com/open/wild-terra-online,MMORPG,PC (Windows),Juvty Worlds Ltd.,Juvty Worlds Ltd.,2017-12-18,https://www.freetogame.com/wild-terra-online
51,Global Adventures,https://www.freetogame.com/g/51/thumbnail.jpg,A free-to-play MMORPG developed by PixelSoft and Published by SubaGames.,https://www.freetogame.com/open/global-adventures,MMORPG,PC (Windows),SubaGames,PixelSoft,2017-12-29,https://www.freetogame.com/global-adventures
52,Closers,https://www.freetogame.com/g/52/thumbnail.jpg,"A free-to-play episodic anime beat-em-up developed 
by Naddic Games and published by 
En Masse Entertainment. ",https://www.freetogame.com/open/closers,MMORPG,PC (Windows),En Masse Entertainment,Naddic Games,2017-12-19,https://www.freetogame.com/closers
322,La Tale Evolved,https://www.freetogame.com/g/322/thumbnail.jpg,A 2D side-scrolling fantasy MMORPG with anime-inspired graphics.,https://www.freetogame.com/open/la-tale,MMORPG,PC (Windows),Papaya Play,Actoz Soft,2017-11-17,https://www.freetogame.com/la-tale
120,Luna Online: Reborn,https://www.freetogame.com/g/120/thumbnail.jpg,"A free-to-play, anime themed fantasy MMORPG and a remake of the previous Luna MMO! ",https://www.freetogame.com/open/luna-online,MMORPG,PC (Windows),Suba Games,Suba Games,2017-10-17,https://www.freetogame.com/luna-online
58,The Ultimatest Battle,https://www.freetogame.com/g/58/thumbnail.jpg,A free-to-play 2D platform game that pits two teams of players against each other in a variety of modes.,https://www.freetogame.com/open/the-ultimatest-battle,Fighting,PC (Windows),Ediogames,Ediogames,2017-09-12,https://www.freetogame.com/the-ultimatest-battle
59,Insidia,https://www.freetogame.com/g/59/thumbnail.jpg,"A free-to-play tactical, turn-based dueling game developed and published by Bad Seed. ",https://www.freetogame.com/open/insidia,Strategy,PC (Windows),Bad Seed,Bad Seed,2017-09-07,https://www.freetogame.com/insidia
30,Quake Champions,https://www.freetogame.com/g/30/thumbnail.jpg,"Quake Champions is a callback to the early days of the Quake IP, featuring the fast-paced action that made the IP popular over two decades ago. ",https://www.freetogame.com/open/quake-champions,Shooter,PC (Windows),Bethesda Softworks,id Software,2017-08-22,https://www.freetogame.com/quake-champions
354,Gods Origin Online,https://www.freetogame.com/g/354/thumbnail.jpg,A free-to-play browser-based RPG from VivaGames in which players take on the role of human summoners that call deities from the Astral Realm back in time.,https://www.freetogame.com/open/gods-origin,MMORPG,Web Browser,VivaGame,VivaGame,2017-08-29,https://www.freetogame.com/gods-origin
61,Black Squad,https://www.freetogame.com/g/61/thumbnail.jpg,A free-to-play military FPS developed by NS STUDIO and published by NEOWIZ.,https://www.freetogame.com/open/black-squad,Shooter,PC (Windows),NEOWIZ,NS Studio,2017-07-28,https://www.freetogame.com/black-squad
64,Secret World Legends,https://www.freetogame.com/g/64/thumbnail.jpg,A free-to-play reboot of The Secret World.,https://www.freetogame.com/open/secret-world-legends,MMORPG,PC (Windows),Funcom,Funcom,2017-07-31,https://www.freetogame.com/secret-world-legends
63,Argo,https://www.freetogame.com/g/63/thumbnail.jpg,A tactical first-person shooter from the Arma 3 developer.,https://www.freetogame.com/open/argo,Shooter,PC (Windows),Bohemia Interactive,Bohemia Interactive,2017-06-22,https://www.freetogame.com/argo
65,Pixel Worlds,https://www.freetogame.com/g/65/thumbnail.jpg,"A free-to-play, side-scroller MMO sandbox game developed and published by Kukouri Mobile Entertainment. ",https://www.freetogame.com/open/pixel-worlds,MMORPG,PC (Windows),Kukouri Mobile Entertainment,Kukouri Mobile Entertainment,2017-06-09,https://www.freetogame.com/pixel-worlds
55,Deceit,https://www.freetogame.com/g/55/thumbnail.jpg,"A free-to-play multiplayer first-person shooter set 
in an asylum! ",https://www.freetogame.com/open/deceit,Shooter,PC (Windows),Automaton,Automaton,2017-05-03,https://www.freetogame.com/deceit
66,Gwent: The Witcher Card Game,https://www.freetogame.com/g/66/thumbnail.jpg,A free-to-play card game based on CD Projekt Red's popular Witcher franchise.,https://www.freetogame.com/open/gwent,Card Game,PC (Windows),CD Projekt Red,CD Projekt Red,2017-05-24,https://www.freetogame.com/gwent
67,Awesomenauts,https://www.freetogame.com/g/67/thumbnail.jpg,A 3v3 2D battle arena Developed by Ronimo games.,https://www.freetogame.com/open/awesomenauts,MOBA,PC (Windows),Ronimo Games,Ronimo Games,2017-05-24,https://www.freetogame.com/awesomenauts
37,Crusaders Of Light,https://www.freetogame.com/g/37/thumbnail.jpg,A cross-platform MMORPG available on PC and mobile devices.,https://www.freetogame.com/open/crusaders-of-light,MMORPG,PC (Windows),Hong Kong Netease Interactive Entertainment Limited,Hong Kong Netease Interactive Entertainment Limited,2017-04-20,https://www.freetogame.com/crusaders-of-light
70,Alien Swarm: Reactive Drop,https://www.freetogame.com/g/70/thumbnail.jpg,A free-to-play top-down tactical co-op expansion on the Alien swarm game and Source SDK.,https://www.freetogame.com/open/alien-swarm-reactive-drop,Shooter,PC (Windows),Reactive Drop,Reactive Drop,2017-04-20,https://www.freetogame.com/alien-swarm-reactive-drop
71,Catan Universe,https://www.freetogame.com/g/71/thumbnail.jpg,A free-to-play strategy game based on the classic board and card games.,https://www.freetogame.com/open/catan-universe,Card Game,PC (Windows),United Soft Media,Exozet,2017-04-25,https://www.freetogame.com/catan-universe
72,Krosmaga,https://www.freetogame.com/g/72/thumbnail.jpg,"A free-to-play CCG/tower defense hybrid developed 
by Ankama Studio and published by 
Ankama Games. ",https://www.freetogame.com/open/krosmaga,Card Game,PC (Windows),Ankama Games,Ankama Studio,2017-04-12,https://www.freetogame.com/krosmaga
355,Chronicles of Eidola,https://www.freetogame.com/g/355/thumbnail.jpg,A free-to-play 3D Browser RPG from AMZGame.,https://www.freetogame.com/open/chronicles-of-eidola,MMORPG,Web Browser,AMZ Games,AMZ Games,2017-04-10,https://www.freetogame.com/chronicles-of-eidola
358,Hunter X Hunter Online,https://www.freetogame.com/g/358/thumbnail.jpg,A free-to-play browser MMORPG based on the popular manga and anime.,https://www.freetogame.com/open/hunter-x-hunter-online,MMORPG,Web Browser,Unigame,Unigame,2017-04-00,https://www.freetogame.com/hunter-x-hunter-online
77,Revelation Online,https://www.freetogame.com/g/77/thumbnail.jpg,A free-to-play fantasy MMO developed by NetEase and published by My.com.,https://www.freetogame.com/open/revelation-online,MMORPG,PC (Windows),My.com,NetEase,2017-03-06,https://www.freetogame.com/revelation-online
87,MU Legend,https://www.freetogame.com/g/87/thumbnail.jpg,A free-to-play MMORPG developed by Webzen and the followup to MU Online.,https://www.freetogame.com/open/mu-legend,MMORPG,PC (Windows),VALOFE,VALOFE,2017-03-23,https://www.freetogame.com/mu-legend
421,Therian Saga,https://www.freetogame.com/g/421/thumbnail.jpg,A browser-based sandbox MMORPG with a complex crafting system.,https://www.freetogame.com/open/therian-saga,MMORPG,"PC (Windows), Web Browser",Gameforge,Virtys,2017-03-27,https://www.freetogame.com/therian-saga
69,Cabals: Card Blitz,https://www.freetogame.com/g/69/thumbnail.jpg,A free-to-play game developed by Kyy Games and published by BISBOG SA.,https://www.freetogame.com/open/cabals-card-blitz,Card Game,PC (Windows),BISBOG SA,Kyy Games,2017-02-08,https://www.freetogame.com/cabals-card-blitz
82,Line of Sight,https://www.freetogame.com/g/82/thumbnail.jpg,"Free FPS game described as ""Bioshock meets Call of Duty""! ",https://www.freetogame.com/open/line-of-sight,Shooter,PC (Windows),BlackSpot Entertainment,BlackSpot Entertainment,2017-01-31,https://www.freetogame.com/line-of-sight
83,Heavy Metal Machines,https://www.freetogame.com/g/83/thumbnail.jpg,A free-to-play multiplayer vehicular combat game based in a post-apocalyptic world.,https://www.freetogame.com/open/heavy-metal-machines,MOBA,PC (Windows),Hoplon,Hoplon,2017-01-31,https://www.freetogame.com/heavy-metal-machines
343,Dragon Awaken,https://www.freetogame.com/g/343/thumbnail.jpg,"A free-to-play, browser-based fantasy RPG developed 
by Game Hollywood and published by 
Proficient City.",https://www.freetogame.com/open/dragon-awaken,MMORPG,Web Browser,Proficient city,Game Hollywood,2017-01-03,https://www.freetogame.com/dragon-awaken
85,Infestation: The New Z,https://www.freetogame.com/g/85/thumbnail.jpg,"A re-work of the open world zombie shooter game Infestation: Survivor Stories (or as it was formerly known ""The War Z"").",https://www.freetogame.com/open/infestation-new-z,Shooter,PC (Windows),OP Productions LLC,Fredaikis AB,2016-11-22,https://www.freetogame.com/infestation-new-z
92,One Tower,https://www.freetogame.com/g/92/thumbnail.jpg,"A unique 1v1 MOBA known as a ""micro-moba"" developed and published by SkyReacher following a successful Kickstarter. ",https://www.freetogame.com/open/one-tower,MOBA,PC (Windows),SkyReacher Entertainment,SkyReacher Entertainment,2016-11-11,https://www.freetogame.com/one-tower
88,Shadowverse,https://www.freetogame.com/g/88/thumbnail.jpg,A free-to-play strategic CCG developed and published by Cygamesm the creators of Rage of Bahamut and Granblu Fantasy.,https://www.freetogame.com/open/shadowverse,Card Game,PC (Windows),"Cygames, Inc.","Cygames, Inc.",2016-10-28,https://www.freetogame.com/shadowverse
89,AdventureQuest 3D,https://www.freetogame.com/g/89/thumbnail.jpg,A free to play cross-platform MMORPG from the creators of the original 2D RPG game.,https://www.freetogame.com/open/adventurequest-3d,MMORPG,PC (Windows),Artix Entertainment,Artix Entertainment,2016-10-19,https://www.freetogame.com/adventurequest-3d
93,Riding Club Championships,https://www.freetogame.com/g/93/thumbnail.jpg,An online competitive horse riding game inspired by traditional equestrian disciplines.,https://www.freetogame.com/open/riding-club-championships,Racing,PC (Windows),Artplant,Artplant,2016-09-27,https://www.freetogame.com/riding-club-championships
