id,title,thumbnail,short_description,game_url,genre,platform,publisher,developer,release_date,freetogame_profile_url
540,Overwatch 2,https://www.freetogame.com/g/540/thumbnail.jpg,A hero-focused first-person team shooter from Blizzard Entertainment.,https://www.freetogame.com/open/overwatch-2,Shooter,PC (Windows),Activision Blizzard,Blizzard Entertainment,2022-10-04,https://www.freetogame.com/overwatch-2
521,Diablo Immortal,https://www.freetogame.com/g/521/thumbnail.jpg,"Built for mobile and also released on PC, Diablo Immortal fills in the gaps between Diablo II and III in an MMOARPG environment.",https://www.freetogame.com/open/diablo-immortal,MMOARPG,PC (Windows),Blizzard Entertainment,Blizzard Entertainment,2022-06-02,https://www.freetogame.com/diablo-immortal
517,Lost Ark,https://www.freetogame.com/g/517/thumbnail.jpg,"Smilegate’s free-to-play multiplayer ARPG is a massive adventure filled with lands waiting to be explored, people waiting to be met, and an ancient evil waiting to be destroyed.",https://www.freetogame.com/open/lost-ark,ARPG,PC (Windows),Amazon Games,Smilegate RPG,2022-02-11,https://www.freetogame.com/lost-ark
516,PUBG: BATTLEGROUNDS,https://www.freetogame.com/g/516/thumbnail.jpg,Get into the action in one of the longest running battle royale games PUBG Battlegrounds.,https://www.freetogame.com/open/pubg,Shooter,PC (Windows),"KRAFTON, Inc.","KRAFTON, Inc.",2022-01-12,https://www.freetogame.com/pubg
508,Enlisted,https://www.freetogame.com/g/508/thumbnail.jpg,Get ready to command your own World War II military squad in Gaijin and Darkflow Software’s MMO squad-based shooter Enlisted.,https://www.freetogame.com/open/enlisted,Shooter,PC (Windows),Gaijin Entertainment,Darkflow Software,2021-04-08,https://www.freetogame.com/enlisted
345,Forge of Empires,https://www.freetogame.com/g/345/thumbnail.jpg,"A free to play 2D browser-based online strategy game, become the leader and raise your city.",https://www.freetogame.com/open/forge-of-empires,Strategy,Web Browser,InnoGames,InnoGames,2012-04-17,https://www.freetogame.com/forge-of-empires
427,Drakensang Online,https://www.freetogame.com/g/427/thumbnail.jpg,A free to play browser-based top-down hack-and-slash 3D MMORPG similar to games in the Diablo series.,https://www.freetogame.com/open/drakensang-online,MMORPG,Web Browser,Bigpoint,Bigpoint,2011-08-08,https://www.freetogame.com/drakensang-online
525,MultiVersus,https://www.freetogame.com/g/525/thumbnail.jpg,The Warner Bros lineup meets Smash in Player First Games’ MultiVersus.,https://www.freetogame.com/open/multiversus,Fighting,PC (Windows),Warner Bros. Games,Player First Games,2022-07-19,https://www.freetogame.com/multiversus
475,Genshin Impact,https://www.freetogame.com/g/475/thumbnail.jpg,"If you’ve been looking for a game to scratch that open-world action RPG itch, one with perhaps a bit of Asian flair, then you’re going to want to check out miHoYo’s Genshin Impact.",https://www.freetogame.com/open/genshin-impact,Action RPG,PC (Windows),miHoYo,miHoYo,2020-09-28,https://www.freetogame.com/genshin-impact
523,Fall Guys,https://www.freetogame.com/g/523/thumbnail.jpg,Play the most competitive massively multiplayer party royale game featuring beans ever for free on a variety of platforms.,https://www.freetogame.com/open/fall-guys,Battle Royale,PC (Windows),Mediatonic,Mediatonic,2020-08-04,https://www.freetogame.com/fall-guys
340,Game Of Thrones Winter Is Coming,https://www.freetogame.com/g/340/thumbnail.jpg,A free-to-play browser-based RTS based on the George R.R. Martin novels and popular HBO series.,https://www.freetogame.com/open/game-of-thrones-winter-is-coming,Strategy,Web Browser,GTArcade,YOOZOO Games,2019-11-14,https://www.freetogame.com/game-of-thrones-winter-is-coming
445,Dark Knight,https://www.freetogame.com/g/445/thumbnail.jpg,A browser-based fantasy MMOARPG wherein players take on the role of a devil hunter descended from the gods.,https://www.freetogame.com/open/dark-knight,MMORPG,Web Browser,Opogame,Opogame,2019-08-06,https://www.freetogame.com/dark-knight
347,Elvenar,https://www.freetogame.com/g/347/thumbnail.jpg,A browser based city-building strategy MMO set in the fantasy world of Elvenar.,https://www.freetogame.com/open/elvenar,Strategy,Web Browser,InnoGames,InnoGames,2015-04-08,https://www.freetogame.com/elvenar
11,Neverwinter,https://www.freetogame.com/g/11/thumbnail.jpg,A free-to-play 3D action MMORPG based on the acclaimed Dungeons & Dragons fantasy roleplaying game.,https://www.freetogame.com/open/neverwinter,MMORPG,PC (Windows),Perfect World Entertainment,Cryptic Studios,2013-12-06,https://www.freetogame.com/neverwinter
380,Dark Orbit Reloaded,https://www.freetogame.com/g/380/thumbnail.jpg,A browser-based 3D space-combat MMO with a massive playerbase!,https://www.freetogame.com/open/darkorbit,Shooter,Web Browser,Bigpoint,Bigpoint,2006-12-11,https://www.freetogame.com/darkorbit
515,Halo Infinite,https://www.freetogame.com/g/515/thumbnail.jpg,"For the first time ever, a free-to-play Halo experience is available in the form of Halo Infinite’s multiplayer.",https://www.freetogame.com/open/halo-infinite,Shooter,PC (Windows),Xbox Game Studios,343 Industries,2021-11-15,https://www.freetogame.com/halo-infinite
458,League of Angels - Heaven's Fury,https://www.freetogame.com/g/458/thumbnail.jpg,"A free-to-play, browser-based fantasy online action RPG based loosely on Western mythology!",https://www.freetogame.com/open/league-of-angels-heavens-fury,MMORPG,Web Browser,Gtarcade,Yoozoo Games,2020-01-09,https://www.freetogame.com/league-of-angels-heavens-fury
455,Eternal Fury,https://www.freetogame.com/g/455/thumbnail.jpg,A free-to-play ARPG from R2 Games!,https://www.freetogame.com/open/eternal-fury,MMORPG,Web Browser,R2 Games,R2 Games,2019-05-21,https://www.freetogame.com/eternal-fury
522,Flyff Universe,https://www.freetogame.com/g/522/thumbnail.jpg,Get the full Flyff experience on any platform with the free-to-play browser-based MMORPG Flyff Universe.,https://www.freetogame.com/open/flyff-universe,MMORPG,Web Browser,Gala Lab,Gala Lab,2022-06-14,https://www.freetogame.com/flyff-universe
511,Phantasy Star Online 2 New Genesis,https://www.freetogame.com/g/511/thumbnail.jpg,The legacy of Phantasy Star Online 2 continues a thousand years later!,https://www.freetogame.com/open/pso2-new-genesis,MMORPG,PC (Windows),Sega,Sega,2021-06-09,https://www.freetogame.com/pso2-new-genesis
5,Crossout,https://www.freetogame.com/g/5/thumbnail.jpg,A post-apocalyptic MMO vehicle combat game!,https://www.freetogame.com/open/crossout,Shooter,PC (Windows),Targem,Gaijin,2017-05-30,https://www.freetogame.com/crossout
9,World of Warships,https://www.freetogame.com/g/9/thumbnail.jpg,A 3D free to play naval action-themed MMO from the creators of World of Tanks!,https://www.freetogame.com/open/world-of-warships,Shooter,PC (Windows),Wargaming,Wargaming,2015-07-02,https://www.freetogame.com/world-of-warships
12,War Thunder,https://www.freetogame.com/g/12/thumbnail.jpg,A MMO shooter that puts you in command of hundreds of the finest combat vehicles of World War II.,https://www.freetogame.com/open/war-thunder,Shooter,PC (Windows),Gaijin Entertainment,Gaijin Entertainment,2013-08-15,https://www.freetogame.com/war-thunder
2,World of Tanks,https://www.freetogame.com/g/2/thumbnail.jpg,"If you like blowing up tanks, with a quick and intense game style you will love this game!",https://www.freetogame.com/open/world-of-tanks,Shooter,PC (Windows),Wargaming,Wargaming,2011-04-12,https://www.freetogame.com/world-of-tanks
529,Tower of Fantasy,https://www.freetogame.com/g/529/thumbnail.jpg,"Tower of Fantasy is a 3D open-world RPG, anime-style sci-fi MMO RPG game with unique characters and beautiful open vistas!",https://www.freetogame.com/open/tower-of-fantasy,MMORPG,PC (Windows),Level Infinite,Hotta Studio,2022-08-10,https://www.freetogame.com/tower-of-fantasy
528,Noah’s Heart,https://www.freetogame.com/g/528/thumbnail.jpg,Noah’s Heart is an open-world MMORPG game with a focus on exploration and socialization.,https://www.freetogame.com/open/noahs-heart,MMORPG,PC (Windows),Archosaur Games,Archosaur Games,2022-07-28,https://www.freetogame.com/noahs-heart
466,Valorant,https://www.freetogame.com/g/466/thumbnail.jpg,Test your mettle in Riot Games’ character-based FPS shooter Valorant.,https://www.freetogame.com/open/valorant,Shooter,PC (Windows),Riot Games,Riot Games,2020-06-02,https://www.freetogame.com/valorant
467,Phantasy Star Online 2,https://www.freetogame.com/g/467/thumbnail.jpg,"Welcome to ARKS, and elite task force searching dangerous planets for the corrupted Falspawn in Phantasy Star 2 Online, Sega’s popular, free-to-play sci-fi MMORPG.",https://www.freetogame.com/open/pso2,MMORPG,PC (Windows),SEGA,SEGA,2020-05-27,https://www.freetogame.com/pso2
452,Call Of Duty: Warzone,https://www.freetogame.com/g/452/thumbnail.jpg,A standalone free-to-play battle royale and modes accessible via Call of Duty: Modern Warfare.,https://www.freetogame.com/open/call-of-duty-warzone,Shooter,PC (Windows),Activision,Infinity Ward,2020-03-10,https://www.freetogame.com/call-of-duty-warzone
21,Destiny 2,https://www.freetogame.com/g/21/thumbnail.jpg,A free-to-play multiplayer Sci-Fi MMOFPS from Bungie.,https://www.freetogame.com/open/destiny-2,Shooter,PC (Windows),Bungie,Bungie,2019-10-01,https://www.freetogame.com/destiny-2
1,Dauntless,https://www.freetogame.com/g/1/thumbnail.jpg,"A free-to-play, co-op action RPG with gameplay similar to Monster Hunter.",https://www.freetogame.com/open/dauntless,MMORPG,PC (Windows),Phoenix Labs,"Phoenix Labs, Iron Galaxy",2019-05-21,https://www.freetogame.com/dauntless
23,Apex Legends,https://www.freetogame.com/g/23/thumbnail.jpg,A free-to-play strategic battle royale game featuring 60-player matches and team-based play.,https://www.freetogame.com/open/apex-legends,Shooter,PC (Windows),Electronic Arts,Electronic Arts,2019-02-04,https://www.freetogame.com/apex-legends
57,Fortnite,https://www.freetogame.com/g/57/thumbnail.jpg,"A free-to-play, standalone mode of Epic Game's Fortnite. ",https://www.freetogame.com/open/fortnite-battle-royale,Shooter,PC (Windows),Epic Games,Epic Games,2017-09-26,https://www.freetogame.com/fortnite-battle-royale
449,Albion Online,https://www.freetogame.com/g/449/thumbnail.jpg,A free-to-play cross-platform sandbox MMO developed and published by Sandbox Interactive GmbH.,https://www.freetogame.com/open/albion-online,MMORPG,PC (Windows),Sandbox Interactive GmbH,Sandbox Interactive GmbH,2017-07-17,https://www.freetogame.com/albion-online
6,Blade and Soul,https://www.freetogame.com/g/6/thumbnail.jpg,A free-to-play martial arts MMORPG that tasks players with learning combination attacks.,https://www.freetogame.com/open/blade-and-soul,MMORPG,PC (Windows),NCSoft,NCSoft,2016-01-19,https://www.freetogame.com/blade-and-soul
212,Brawlhalla,https://www.freetogame.com/g/212/thumbnail.jpg,A free-to-play 2D platform fighter inspired by the Smash Bros.,https://www.freetogame.com/open/brawlhalla,Fighting,PC (Windows),Blue Mammoth Games,Blue Mammoth Games,2015-11-03,https://www.freetogame.com/brawlhalla
8,Trove,https://www.freetogame.com/g/8/thumbnail.jpg,A free to play Sandbox massively multiplayer online role-playing game!,https://www.freetogame.com/open/trove,MMORPG,PC (Windows),Trion Worlds,Trion Worlds,2015-07-09,https://www.freetogame.com/trove
202,Heroes & Generals,https://www.freetogame.com/g/202/thumbnail.jpg,"A World War II-based MMOFPS that mixes infantry, armor, and aircraft.",https://www.freetogame.com/open/heroes-and-generals,Shooter,PC (Windows),Reto-Moto,Reto-Moto,2014-07-11,https://www.freetogame.com/heroes-and-generals
207,Warface,https://www.freetogame.com/g/207/thumbnail.jpg,"A free-to-play multiplayer online FPS from Crytek, makers of the Far Cry and Crysis series of games.",https://www.freetogame.com/open/warface,Shooter,PC (Windows),Crytek,Crytek,2014-07-01,https://www.freetogame.com/warface
217,Smite,https://www.freetogame.com/g/217/thumbnail.jpg,A popular free-to-play 3D MOBA where you take on the role of an ancient god.,https://www.freetogame.com/open/smite,MOBA,PC (Windows),Hi-Rez Studios,Hi-Rez Studios,2014-03-25,https://www.freetogame.com/smite
3,Warframe,https://www.freetogame.com/g/3/thumbnail.jpg,A cooperative free-to-play third person online action shooter set in an stunning sci-fi world.,https://www.freetogame.com/open/warframe,Shooter,PC (Windows),Digital Extremes,Digital Extremes,2013-03-25,https://www.freetogame.com/warframe
243,PlanetSide 2,https://www.freetogame.com/g/243/thumbnail.jpg,A free-to-play open-world FPS that pits three factions against each other in a never-ending war.,https://www.freetogame.com/open/planetside-2,Shooter,PC (Windows),Daybreak Games,Daybreak Games,2012-11-21,https://www.freetogame.com/planetside-2
13,Guild Wars 2,https://www.freetogame.com/g/13/thumbnail.jpg,"A free-to-play MMORPG, the follow-up to ArenaNet's popular Guild Wars. ",https://www.freetogame.com/open/guild-wars-2,MMORPG,PC (Windows),NCsoft,ArenaNet,2012-08-28,https://www.freetogame.com/guild-wars-2
14,Star Trek Online,https://www.freetogame.com/g/14/thumbnail.jpg,"A free-to-play, 3D, Sci-Fi MMORPG based on the popular Star Trek series.",https://www.freetogame.com/open/star-trek-online,MMORPG,PC (Windows),Perfect World Entertainment,Cryptic Studios,2010-02-02,https://www.freetogame.com/star-trek-online
433,RuneScape,https://www.freetogame.com/g/433/thumbnail.jpg,A popular 3D browser MMORPG boasting a huge player base and 15 years of content.,https://www.freetogame.com/open/runescape,MMORPG,"PC (Windows), Web Browser",Jagex,Jagex,2001-01-04,https://www.freetogame.com/runescape
541,Marvel Snap,https://www.freetogame.com/g/541/thumbnail.jpg,A fast paced strategy card game set in the Marvel universe.,https://www.freetogame.com/open/marvel-snap,Card Game,PC (Windows),Nuverse,"Second Dinner Studios, Inc.",2022-10-18,https://www.freetogame.com/marvel-snap
542,World Boss,https://www.freetogame.com/g/542/thumbnail.jpg,An experimental FPS based on io and roguelike gameplay.,https://www.freetogame.com/open/world-boss,Shooter,PC (Windows),Playside,Playside,2022-10-19,https://www.freetogame.com/world-boss
536,Omega Strikers,https://www.freetogame.com/g/536/thumbnail.jpg,A 3v3 socccer-style game with knockouts.,https://www.freetogame.com/open/omega-strikers,Sports,PC (Windows),Odyssey Interactive,Odyssey Interactive,2022-09-16,https://www.freetogame.com/omega-strikers
537,Gundam Evolution,https://www.freetogame.com/g/537/thumbnail.jpg,A 6v6 team-based shooter based on the Gundam multiverse,https://www.freetogame.com/open/gundam-evolution,Shooter,PC (Windows),Bandai Namco,Bandai Namco,2022-09-21,https://www.freetogame.com/gundam-evolution
539,Deathverse: Let It Die,https://www.freetogame.com/g/539/thumbnail.jpg,A game of survival where contestants are pit against each other in a life or death game show.,https://www.freetogame.com/open/deathverse-let-it-die,Battle Royale,PC (Windows),"Supertrick Games, Inc.","GungHo Online Entertianment, Inc.",2022-09-28,https://www.freetogame.com/deathverse-let-it-die
544,Galahad 3093,https://www.freetogame.com/g/544/thumbnail.jpg,A 12v12 team shooter featuring mechs based on Arthurian legend.,https://www.freetogame.com/open/galahad-3093,Shooter,PC (Windows),Simutronics Corp.,Simutronics Corp.,2022-09-01,https://www.freetogame.com/galahad-3093
527,Aero Tales Online,https://www.freetogame.com/g/527/thumbnail.jpg,Aero Tales Online: The World is a free-to-play 3D anime-style MMORPG with PvP and PvE elements. The game revolves around the “mysterious story of the Key of Skylight”.,https://www.freetogame.com/open/aero-tales-online,MMORPG,PC (Windows),Anisage Games,Anisage Games,2022-08-01,https://www.freetogame.com/aero-tales-online
530,Rumbleverse,https://www.freetogame.com/g/530/thumbnail.jpg,"Take 40 people, throw them into a city, give them weapons and let them fight it out. That’s the recipe for Iron Galaxy Studios’ new free-to-play Brawler Royale Rumbleverse.",https://www.freetogame.com/open/rumbleverse,Battle Royale,PC (Windows),Epic Games Publishing,Iron Galaxy Studios,2022-08-11,https://www.freetogame.com/rumbleverse
531,Magic Spellslingers,https://www.freetogame.com/g/531/thumbnail.jpg,Magic Spellslingers is the latest entry based on Witzards of the Coast’s popular card game Magic: The Gathering.,https://www.freetogame.com/open/magic-spellslingers,Card Game,PC (Windows),Wizards of the Coast LLC,"Pipeworks Studios, Seismic Games",2022-08-05,https://www.freetogame.com/magic-spellslingers
533,A.V.A Global,https://www.freetogame.com/g/533/thumbnail.jpg,"A.V.A is a free-to-play online first-person shooter with multiple game modes, unique customizations, as well as PvP and PvE gameplay.",https://www.freetogame.com/open/ava,MMOFPS,PC (Windows),NEOWIZ,NEOWIZ,2022-08-24,https://www.freetogame.com/ava
534,Lost Light,https://www.freetogame.com/g/534/thumbnail.jpg,A post-apocalyptic shooter built around creating a realistic experience.,https://www.freetogame.com/open/lost-light,Shooter,PC (Windows),NetEase Games,NetEase Games,2022-08-04,https://www.freetogame.com/lost-light
524,Temperia: Soul of Majestic,https://www.freetogame.com/g/524/thumbnail.jpg,"Fans of collectible card games, are you looking for something a bit different from the normal fare? Then a peek at Moonwolf Entertainment and A2 Softworks’ Temperia: Soul of Majestic might be in order.",https://www.freetogame.com/open/temperia,Card Game,PC (Windows),Leonardo Interactive,"MoonWolf Entertainment, A2 Softworks",2022-07-26,https://www.freetogame.com/temperia
526,Chimeraland,https://www.freetogame.com/g/526/thumbnail.jpg,"Explore the open-world sandbox MMO game set in a mythical world. Play as one of a large number of races, from jelly-fish to dragon-person – or even a regular old human if that’s your thing. Explore the land, gather resources, craft items, build homes and more.",https://www.freetogame.com/open/chimeraland,MMORPG,PC (Windows),Level Infinite,Pixel soft,2022-07-14,https://www.freetogame.com/chimeraland
532,World of Runes,https://www.freetogame.com/g/532/thumbnail.jpg,An adorable anime-style MMO featuring cute pets and collectable cards.,https://www.freetogame.com/open/world-of-runes,MMORPG,Web Browser,F5 Game Company Limited,R2 Games,2022-06-13,https://www.freetogame.com/world-of-runes
520,Roller Champions,https://www.freetogame.com/g/520/thumbnail.jpg,"What if you could player roller derby, but in a more organized and less physically dangerous environment?",https://www.freetogame.com/open/roller-champions,Sports,PC (Windows),Ubisoft,Ubisoft,2022-05-25,https://www.freetogame.com/roller-champions
519,Space Punks,https://www.freetogame.com/g/519/thumbnail.jpg,Space Punks is a sci-fi co-op looter shooter with graphics and humor that will likely appeal to the Borderlands fans among us.,https://www.freetogame.com/open/space-punks,Shooter,PC (Windows),JAGEX,Flying Wild Hog,2022-04-20,https://www.freetogame.com/space-punks
518,Swords of Legends Online,https://www.freetogame.com/g/518/thumbnail.jpg,Explore a fantasy world based on Chinese mythology in Gameforge’s action MMORPG Swords of Legends Online!,https://www.freetogame.com/open/swords-of-legends-online,MMORPG,PC (Windows),Gameforge,Wangyuan Shengtang Entertainment,2021-07-09,https://www.freetogame.com/swords-of-legends-online
513,Super Squad,https://www.freetogame.com/g/513/thumbnail.jpg,Prepare yourself. It’s time for Mayhem. Super Squad is a multi-player online shoot-’em-up (or MOSH)!,https://www.freetogame.com/open/super-squad,Moba,PC (Windows),Bad Fox Studios,Bad Fox Studios,2021-06-25,https://www.freetogame.com/super-squad
512,Sherwood Extreme,https://www.freetogame.com/g/512/thumbnail.jpg,High action arcade shooter Sherwood Extreme sends players on a mission to save the kingdom!,https://www.freetogame.com/open/sherwood-extreme,Shooter,PC (Windows),CAGE Studios,CAGE Studios,2021-05-12,https://www.freetogame.com/sherwood-extreme
509,Smash Legends,https://www.freetogame.com/g/509/thumbnail.jpg,Classic fairy tales get wild with 5minlab and LINE Games Corporation’s brawl-action game Smash Legends.,https://www.freetogame.com/open/smash-legends,Fighting,PC (Windows),LINE Games Corporation,5minlab,2021-04-13,https://www.freetogame.com/smash-legends
510,Drifters Loot the Galaxy,https://www.freetogame.com/g/510/thumbnail.jpg,"Grab your Driftpacs and grappling hooks, it’s time to loot. Pick a character and dive into Blind Squirrel’s team-based shooter, Drifters Loot the Galaxy.",https://www.freetogame.com/open/drifters-loot-the-galaxy,Shooter,PC (Windows),Blind Squirrel Entertainment,Blind Squirrel Entertainment,2021-04-15,https://www.freetogame.com/drifters-loot-the-galaxy
502,Primordials: Battle of Gods,https://www.freetogame.com/g/502/thumbnail.jpg,Build armies and fight for control of the realm in Global Dodo Entertainment’s 1v1 strategy game Primordials: Battle of Gods.,https://www.freetogame.com/open/primordials-battle-of-gods,Strategy,PC (Windows),Wire Games,Global Dodo Entertainment,2021-03-04,https://www.freetogame.com/primordials-battle-of-gods
507,Super Mecha Champions,https://www.freetogame.com/g/507/thumbnail.jpg,"Super Mecha Champions is a PC port of the mobile anime PvP game from NetEease, featuring a variety of modes but focusing on battle royale.",https://www.freetogame.com/open/super-mecha-champions,Shooter,PC (Windows),NetEase Games,NetEase Games,2021-03-25,https://www.freetogame.com/super-mecha-champions
500,Chroma: Bloom And Blight,https://www.freetogame.com/g/500/thumbnail.jpg,"Competitive card game fans have a new, completely free option to add to their list. ",https://www.freetogame.com/open/chroma-bloom-and-blight,Card Game,PC (Windows),WhisperGames,Clarity Games,2021-01-28,https://www.freetogame.com/chroma-bloom-and-blight
497,Astellia Royal,https://www.freetogame.com/g/497/thumbnail.jpg,"Gamers interested in Studio8’s MMO Astellia now have a new – and slightly different – free-to-play option, Astellia Royal",https://www.freetogame.com/open/astellia-royal,MMORPG,PC (Windows),Way2Bit,Studio 8,2020-12-12,https://www.freetogame.com/astellia-royal
498,Blankos Block Party,https://www.freetogame.com/g/498/thumbnail.jpg,"What happens when you take the vinyl collectible toy experience and combine it with an open-world multiplayer game? You get Blankos Block Party!
",https://www.freetogame.com/open/blankos,MMO,PC (Windows),Third Kind Games,Mythical Games Inc,2020-12-11,https://www.freetogame.com/blankos
499,Slapshot: Rebound,https://www.freetogame.com/g/499/thumbnail.jpg,"Do you like hockey? How about physic-based multiplayer, arcade-style sports games with cute graphics? Well, this is the one for you.",https://www.freetogame.com/open/slapshot-rebound,Sports,PC (Windows),Oddshot Games,Oddshot Games,2020-12-07,https://www.freetogame.com/slapshot-rebound
476,Rogue Company,https://www.freetogame.com/g/476/thumbnail.jpg,"From Hi-Rez Studios, the team that brought you Smite and Paladins, comes Rogue Company, a cross-platform, competitive team-based third person shooter.",https://www.freetogame.com/open/rogue-company,Shooter,PC (Windows),Nexon,Valofe,2020-10-01,https://www.freetogame.com/rogue-company
477,Eternal Return: Black Survival,https://www.freetogame.com/g/477/thumbnail.jpg,"Combining elements from battle royale, MOBA, and the survival genres, Eternal Return: Black Survival is a game designed with a broad audience in mind. ",https://www.freetogame.com/open/eternal-return,MOBA,PC (Windows),Nimble Neuron,Nimble Neuron,2020-10-14,https://www.freetogame.com/eternal-return
479,Blood of Steel,https://www.freetogame.com/g/479/thumbnail.jpg,"Blood of Steel is an online competitive strategy game featuring some of the most well-known figures throughout medieval history. Choose your general – a Crusader, Viking, Ninja or one of those from the Three Kingdoms. Build your kingdom and command armies in epic PvP battles using classic medieval warfare tactics.",https://www.freetogame.com/open/blood-of-steel,Strategy,PC (Windows),YC Games,YC Games,2020-10-20,https://www.freetogame.com/blood-of-steel
473,Spellbreak,https://www.freetogame.com/g/473/thumbnail.jpg,"Spellbreak is a multiplayer, multi-platform battle-royale where player take on the role of a “battlemage” mastering elemental magic and using spells to compete against other players.",https://www.freetogame.com/open/spellbreak,Battle Royale,PC (Windows),Proletariat,Proletariat,2020-09-04,https://www.freetogame.com/spellbreak
474,Rocket League,https://www.freetogame.com/g/474/thumbnail.jpg,Get your car-soccer gaming on for free with Psyonix’s Rocket League. The popular competitive multi-player game is a popular offering with over 57 million players.,https://www.freetogame.com/open/rocket-league,Sports,PC (Windows),Psyonix LLC,Psyonix LLC,2020-09-24,https://www.freetogame.com/rocket-league
471,Armor Valor,https://www.freetogame.com/g/471/thumbnail.jpg,Build your empire with the help of mythical heroes and well thought out strategy in R2 Games’ strategy RPG Armor Valor.,https://www.freetogame.com/open/armor-valor,Strategy,Web Browser,R2 Games,R2 Games,2020-07-20,https://www.freetogame.com/armor-valor
469,Unfortunate Spacemen,https://www.freetogame.com/g/469/thumbnail.jpg,"Unfortunate Spacemen is a co-op multiplayer game about Shapeshifting with a Co-op Story Mode, lots of objectives and more!",https://www.freetogame.com/open/unfortunate-spacemen,Shooter,PC (Windows),New Blood Interactive,Geoff 'Zag' Keene,2020-06-12,https://www.freetogame.com/unfortunate-spacemen
472,Jade Goddess,https://www.freetogame.com/g/472/thumbnail.jpg,"Jade Goddess is a free-to-play, browser based MMO inspired by Eastern mythology.",https://www.freetogame.com/open/jade-goddess,MMORPG,Web Browser,101XP,101XP,2020-06-15,https://www.freetogame.com/jade-goddess
